A1: data period - from: 2014-01-01 00:00:00 to: 2014-01-06 10:18:58
A3: ЦЕХ М-5
A5: МЕСЯЧНЫЙ БАЛАНС СЫРЬЯ И ПОТРЕБЛЕНИЯ ЭНЕРГОРЕСУРСОВ
B7: NH3 | F7: ПГ | J7: Перегретый Пар | N7: Вода Химочищенная | S7: Вода Oборотная | V7: Электроэнергия | Y7: HNO3
A8: Время | B8: отд. 1 | C8: отд. 2 | D8: по цеху | E8: Расх. коэф. План (0.298) | F8: отд. 1 | G8: отд. 2 | H8: по цеху | I8: Расх. коэф. План (95.0) | J8: отд. 1 | K8: отд. 2 | L8: по цеху | M8: Расх. коэф. План (0.900) | N8: отд. 1 | O8: отд. 2 | P8: по цеху | Q8: Расх. коэф. План (1.5) | R8: отд. 1 | S8: отд. 2 | T8: по цеху | U8: Расх. коэф. План (159.0) | V8: по цеху | W8: не норм. Расход | X8: Расх. коэф. План (39.0) | Y8: по потребителям | Z8: по АСМ
A9: день | B9: т/сут | C9: т/сут | D9: т/сут | E9: 1 т.мнг | F9: м3/сут | G9: м3/сут | H9: м3/сут | I9: 1 т.мнг | J9: Гкал/сут | K9: Гкал/сут | L9: Гкал/сут | M9: 1 т.мнг | N9: м3/сут | O9: м3/сут | P9: м3/сут | Q9: 1 т.мнг | R9: м3/сут | S9: м3/сут | T9: м3/сут | U9: 1 т.мнг | V9: кВт*ч | W9: кВт*ч | X9: 1 т.мнг | Y9: т.мнг/сут | Z9: т.мнг/сут
A11: 41640 | B11: 93.250991821289063 | C11: 276.31861877441406 | D11: =SUM(B11,C11) -> 369.56961059570312 | E11: =IF((Y11=0),0,D11/Y11) -> 0.29577613637584838 | F11: 32107.997894287109 | G11: 94347.984313964844 | H11: =SUM(F11,G11) -> 126455.98220825195 | I11: =IF((Y11=0),0,H11/Y11) -> 101.20599953789775 | J11: 278.20196533203125 | K11: 891.17843627929687 | L11: =SUM(J11,K11) -> 1169.3804016113281 | M11: =IF((Y11=0),0,L11/Y11) -> 0.93588543869915775 | N11: 776.99995040893555 | O11: 2319.2465305328369 | P11: =SUM(N11,O11) -> 3096.2464809417725 | Q11: =IF((Y11=0),0,P11/Y11) -> 2.4780062947386776 | R11: 0 | S11: 134335.73505282402 | T11: 228600 | U11: =IF((Y11=0),0,T11/Y11) -> 182.95450393373082 | V11: 51974.87109375 | W11: 7387 | X11: =IF((Y11=0),0,(V11-W11)/Y11) -> 35.684828685118845 | Y11: 1249.490966796875 | Z11: 1246.8699951171875
A12: 41641 | B12: 91.919609069824219 | C12: 263.61733245849609 | D12: =SUM(B12,C12) -> 355.53694152832031 | E12: =IF((Y12=0),0,D12/Y12) -> 0.29401003086513222 | F12: 31711.997985839844 | G12: 93077.865600585938 | H12: =SUM(F12,G12) -> 124789.86358642578 | I12: =IF((Y12=0),0,H12/Y12) -> 103.19454143635924 | J12: 275.40597534179687 | K12: 869.14089965820312 | L12: =SUM(J12,K12) -> 1144.546875 | M12: =IF((Y12=0),0,L12/Y12) -> 0.94647903702725655 | N12: 776.99995040893555 | O12: 2172.2345352172852 | P12: =SUM(N12,O12) -> 2949.2344856262207 | Q12: =IF((Y12=0),0,P12/Y12) -> 2.4388591475758314 | R12: 0 | S12: 133987.92906105518 | T12: 232675 | U12: =IF((Y12=0),0,T12/Y12) -> 192.4097778348457 | V12: 52392.37109375 | W12: 7387 | X12: =IF((Y12=0),0,(V12-W12)/Y12) -> 37.21703429041893 | Y12: 1209.26806640625 | Z12: 1201.949951171875
A13: 41642 | B13: 91.446495056152344 | C13: 262.04991912841797 | D13: =SUM(B13,C13) -> 353.49641418457031 | E13: =IF((Y13=0),0,D13/Y13) -> 0.30006803966999013 | F13: 31799 | G13: 92697.402954101563 | H13: =SUM(F13,G13) -> 124496.40295410156 | I13: =IF((Y13=0),0,H13/Y13) -> 105.67969032041465 | J13: 269.81399999999996 | K13: 880.3995361328125 | L13: =SUM(J13,K13) -> 1150.2135361328124 | M13: =IF((Y13=0),0,L13/Y13) -> 0.9763672477001476 | N13: 765 | O13: 2100.738525390625 | P13: =SUM(N13,O13) -> 2865.738525390625 | Q13: =IF((Y13=0),0,P13/Y13) -> 2.4326032938816367 | R13: 0 | S13: 134120.30952423811 | T13: 232190 | U13: =IF((Y13=0),0,T13/Y13) -> 197.09619485587456 | V13: 52293.120000000003 | W13: 7387 | X13: =IF((Y13=0),0,(V13-W13)/Y13) -> 38.11889132926175 | Y13: 1178.05419921875 | Z13: 1185.9200439453125
A14: 41643 | B14: 91.186897277832031 | C14: 262.01622009277344 | D14: =SUM(B14,C14) -> 353.20311737060547 | E14: =IF((Y14=0),0,D14/Y14) -> 0.29790430370746435 | F14: 31634 | G14: 91484.962463378906 | H14: =SUM(F14,G14) -> 123118.96246337891 | I14: =IF((Y14=0),0,H14/Y14) -> 103.84299283336605 | J14: 264.92099999999999 | K14: 895.51266479492187 | L14: =SUM(J14,K14) -> 1160.4336647949219 | M14: =IF((Y14=0),0,L14/Y14) -> 0.9787517887241679 | N14: 768 | O14: 2131.8569183349609 | P14: =SUM(N14,O14) -> 2899.8569183349609 | Q14: =IF((Y14=0),0,P14/Y14) -> 2.4458443700580554 | R14: 0 | S14: 134226.0729148984 | T14: 230104 | U14: =IF((Y14=0),0,T14/Y14) -> 194.07804894421696 | V14: 56509.919999999998 | W14: 7387 | X14: =IF((Y14=0),0,(V14-W14)/Y14) -> 41.432050168805645 | Y14: 1185.6260986328125 | Z14: 1194.0899658203125
A15: 41644 | B15: 0.00 | C15: 0.00 | D15: =SUM(B15,C15) -> 0.00 | E15: =IF((Y15=0),0,D15/Y15) -> 0.000 | F15: 31723 | G15: 0 | H15: =SUM(F15,G15) -> 31723 | I15: =IF((Y15=0),0,H15/Y15) -> 0.0 | J15: 261.42599999999999 | K15: 0.00 | L15: =SUM(J15,K15) -> 261.42599999999999 | M15: =IF((Y15=0),0,L15/Y15) -> 0.000 | N15: 759 | O15: 0 | P15: =SUM(N15,O15) -> 759 | Q15: =IF((Y15=0),0,P15/Y15) -> 0.0 | R15: 0 | S15: 0 | T15: 0 | U15: =IF((Y15=0),0,T15/Y15) -> 0.0 | V15: 57581.17 | W15: 7387 | X15: =IF((Y15=0),0,(V15-W15)/Y15) -> 0.0 | Y15: 0.00 | Z15: 0.00
A16: 41645 | B16: 0.00 | C16: 0.00 | D16: =SUM(B16,C16) -> 0.00 | E16: =IF((Y16=0),0,D16/Y16) -> 0.000 | F16: 0 | G16: 0 | H16: =SUM(F16,G16) -> 0 | I16: =IF((Y16=0),0,H16/Y16) -> 0.0 | J16: 0.00 | K16: 0.00 | L16: =SUM(J16,K16) -> 0.00 | M16: =IF((Y16=0),0,L16/Y16) -> 0.000 | N16: 0 | O16: 0 | P16: =SUM(N16,O16) -> 0 | Q16: =IF((Y16=0),0,P16/Y16) -> 0.0 | R16: 0 | S16: 0 | T16: 0 | U16: =IF((Y16=0),0,T16/Y16) -> 0.0 | V16: 0 | W16: 0 | X16: =IF((Y16=0),0,(V16-W16)/Y16) -> 0.0 | Y16: 0.00 | Z16: 0.00
A17: 0 | B17: 0.00 | C17: 0.00 | D17: =SUM(B17,C17) -> 0.00 | E17: =IF((Y17=0),0,D17/Y17) -> 0.000 | F17: 0 | G17: 0 | H17: =SUM(F17,G17) -> 0 | I17: =IF((Y17=0),0,H17/Y17) -> 0.0 | J17: 0.00 | K17: 0.00 | L17: =SUM(J17,K17) -> 0.00 | M17: =IF((Y17=0),0,L17/Y17) -> 0.000 | N17: 0 | O17: 0 | P17: =SUM(N17,O17) -> 0 | Q17: =IF((Y17=0),0,P17/Y17) -> 0.0 | R17: 0 | S17: 0 | T17: 0 | U17: =IF((Y17=0),0,T17/Y17) -> 0.0 | V17: 0 | W17: 0 | X17: =IF((Y17=0),0,(V17-W17)/Y17) -> 0.0 | Y17: 0.00 | Z17: 0.00
A18: 0 | B18: 0.00 | C18: 0.00 | D18: =SUM(B18,C18) -> 0.00 | E18: =IF((Y18=0),0,D18/Y18) -> 0.000 | F18: 0 | G18: 0 | H18: =SUM(F18,G18) -> 0 | I18: =IF((Y18=0),0,H18/Y18) -> 0.0 | J18: 0.00 | K18: 0.00 | L18: =SUM(J18,K18) -> 0.00 | M18: =IF((Y18=0),0,L18/Y18) -> 0.000 | N18: 0 | O18: 0 | P18: =SUM(N18,O18) -> 0 | Q18: =IF((Y18=0),0,P18/Y18) -> 0.0 | R18: 0 | S18: 0 | T18: 0 | U18: =IF((Y18=0),0,T18/Y18) -> 0.0 | V18: 0 | W18: 0 | X18: =IF((Y18=0),0,(V18-W18)/Y18) -> 0.0 | Y18: 0.00 | Z18: 0.00
A19: 0 | B19: 0.00 | C19: 0.00 | D19: =SUM(B19,C19) -> 0.00 | E19: =IF((Y19=0),0,D19/Y19) -> 0.000 | F19: 0 | G19: 0 | H19: =SUM(F19,G19) -> 0 | I19: =IF((Y19=0),0,H19/Y19) -> 0.0 | J19: 0.00 | K19: 0.00 | L19: =SUM(J19,K19) -> 0.00 | M19: =IF((Y19=0),0,L19/Y19) -> 0.000 | N19: 0 | O19: 0 | P19: =SUM(N19,O19) -> 0 | Q19: =IF((Y19=0),0,P19/Y19) -> 0.0 | R19: 0 | S19: 0 | T19: 0 | U19: =IF((Y19=0),0,T19/Y19) -> 0.0 | V19: 0 | W19: 0 | X19: =IF((Y19=0),0,(V19-W19)/Y19) -> 0.0 | Y19: 0.00 | Z19: 0.00
A20: 0 | B20: 0.00 | C20: 0.00 | D20: =SUM(B20,C20) -> 0.00 | E20: =IF((Y20=0),0,D20/Y20) -> 0.000 | F20: 0 | G20: 0 | H20: =SUM(F20,G20) -> 0 | I20: =IF((Y20=0),0,H20/Y20) -> 0.0 | J20: 0.00 | K20: 0.00 | L20: =SUM(J20,K20) -> 0.00 | M20: =IF((Y20=0),0,L20/Y20) -> 0.000 | N20: 0 | O20: 0 | P20: =SUM(N20,O20) -> 0 | Q20: =IF((Y20=0),0,P20/Y20) -> 0.0 | R20: 0 | S20: 0 | T20: 0 | U20: =IF((Y20=0),0,T20/Y20) -> 0.0 | V20: 0 | W20: 0 | X20: =IF((Y20=0),0,(V20-W20)/Y20) -> 0.0 | Y20: 0.00 | Z20: 0.00
A21: 0 | B21: 0.00 | C21: 0.00 | D21: =SUM(B21,C21) -> 0.00 | E21: =IF((Y21=0),0,D21/Y21) -> 0.000 | F21: 0 | G21: 0 | H21: =SUM(F21,G21) -> 0 | I21: =IF((Y21=0),0,H21/Y21) -> 0.0 | J21: 0.00 | K21: 0.00 | L21: =SUM(J21,K21) -> 0.00 | M21: =IF((Y21=0),0,L21/Y21) -> 0.000 | N21: 0 | O21: 0 | P21: =SUM(N21,O21) -> 0 | Q21: =IF((Y21=0),0,P21/Y21) -> 0.0 | R21: 0 | S21: 0 | T21: 0 | U21: =IF((Y21=0),0,T21/Y21) -> 0.0 | V21: 0 | W21: 0 | X21: =IF((Y21=0),0,(V21-W21)/Y21) -> 0.0 | Y21: 0.00 | Z21: 0.00
A22: 0 | B22: 0.00 | C22: 0.00 | D22: =SUM(B22,C22) -> 0.00 | E22: =IF((Y22=0),0,D22/Y22) -> 0.000 | F22: 0 | G22: 0 | H22: =SUM(F22,G22) -> 0 | I22: =IF((Y22=0),0,H22/Y22) -> 0.0 | J22: 0.00 | K22: 0.00 | L22: =SUM(J22,K22) -> 0.00 | M22: =IF((Y22=0),0,L22/Y22) -> 0.000 | N22: 0 | O22: 0 | P22: =SUM(N22,O22) -> 0 | Q22: =IF((Y22=0),0,P22/Y22) -> 0.0 | R22: 0 | S22: 0 | T22: 0 | U22: =IF((Y22=0),0,T22/Y22) -> 0.0 | V22: 0 | W22: 0 | X22: =IF((Y22=0),0,(V22-W22)/Y22) -> 0.0 | Y22: 0.00 | Z22: 0.00
A23: 0 | B23: 0.00 | C23: 0.00 | D23: =SUM(B23,C23) -> 0.00 | E23: =IF((Y23=0),0,D23/Y23) -> 0.000 | F23: 0 | G23: 0 | H23: =SUM(F23,G23) -> 0 | I23: =IF((Y23=0),0,H23/Y23) -> 0.0 | J23: 0.00 | K23: 0.00 | L23: =SUM(J23,K23) -> 0.00 | M23: =IF((Y23=0),0,L23/Y23) -> 0.000 | N23: 0 | O23: 0 | P23: =SUM(N23,O23) -> 0 | Q23: =IF((Y23=0),0,P23/Y23) -> 0.0 | R23: 0 | S23: 0 | T23: 0 | U23: =IF((Y23=0),0,T23/Y23) -> 0.0 | V23: 0 | W23: 0 | X23: =IF((Y23=0),0,(V23-W23)/Y23) -> 0.0 | Y23: 0.00 | Z23: 0.00
A24: 0 | B24: 0.00 | C24: 0.00 | D24: =SUM(B24,C24) -> 0.00 | E24: =IF((Y24=0),0,D24/Y24) -> 0.000 | F24: 0 | G24: 0 | H24: =SUM(F24,G24) -> 0 | I24: =IF((Y24=0),0,H24/Y24) -> 0.0 | J24: 0.00 | K24: 0.00 | L24: =SUM(J24,K24) -> 0.00 | M24: =IF((Y24=0),0,L24/Y24) -> 0.000 | N24: 0 | O24: 0 | P24: =SUM(N24,O24) -> 0 | Q24: =IF((Y24=0),0,P24/Y24) -> 0.0 | R24: 0 | S24: 0 | T24: 0 | U24: =IF((Y24=0),0,T24/Y24) -> 0.0 | V24: 0 | W24: 0 | X24: =IF((Y24=0),0,(V24-W24)/Y24) -> 0.0 | Y24: 0.00 | Z24: 0.00
A25: 0 | B25: 0.00 | C25: 0.00 | D25: =SUM(B25,C25) -> 0.00 | E25: =IF((Y25=0),0,D25/Y25) -> 0.000 | F25: 0 | G25: 0 | H25: =SUM(F25,G25) -> 0 | I25: =IF((Y25=0),0,H25/Y25) -> 0.0 | J25: 0.00 | K25: 0.00 | L25: =SUM(J25,K25) -> 0.00 | M25: =IF((Y25=0),0,L25/Y25) -> 0.000 | N25: 0 | O25: 0 | P25: =SUM(N25,O25) -> 0 | Q25: =IF((Y25=0),0,P25/Y25) -> 0.0 | R25: 0 | S25: 0 | T25: 0 | U25: =IF((Y25=0),0,T25/Y25) -> 0.0 | V25: 0 | W25: 0 | X25: =IF((Y25=0),0,(V25-W25)/Y25) -> 0.0 | Y25: 0.00 | Z25: 0.00
A26: 0 | B26: 0.00 | C26: 0.00 | D26: =SUM(B26,C26) -> 0.00 | E26: =IF((Y26=0),0,D26/Y26) -> 0.000 | F26: 0 | G26: 0 | H26: =SUM(F26,G26) -> 0 | I26: =IF((Y26=0),0,H26/Y26) -> 0.0 | J26: 0.00 | K26: 0.00 | L26: =SUM(J26,K26) -> 0.00 | M26: =IF((Y26=0),0,L26/Y26) -> 0.000 | N26: 0 | O26: 0 | P26: =SUM(N26,O26) -> 0 | Q26: =IF((Y26=0),0,P26/Y26) -> 0.0 | R26: 0 | S26: 0 | T26: 0 | U26: =IF((Y26=0),0,T26/Y26) -> 0.0 | V26: 0 | W26: 0 | X26: =IF((Y26=0),0,(V26-W26)/Y26) -> 0.0 | Y26: 0.00 | Z26: 0.00
A27: 0 | B27: 0.00 | C27: 0.00 | D27: =SUM(B27,C27) -> 0.00 | E27: =IF((Y27=0),0,D27/Y27) -> 0.000 | F27: 0 | G27: 0 | H27: =SUM(F27,G27) -> 0 | I27: =IF((Y27=0),0,H27/Y27) -> 0.0 | J27: 0.00 | K27: 0.00 | L27: =SUM(J27,K27) -> 0.00 | M27: =IF((Y27=0),0,L27/Y27) -> 0.000 | N27: 0 | O27: 0 | P27: =SUM(N27,O27) -> 0 | Q27: =IF((Y27=0),0,P27/Y27) -> 0.0 | R27: 0 | S27: 0 | T27: 0 | U27: =IF((Y27=0),0,T27/Y27) -> 0.0 | V27: 0 | W27: 0 | X27: =IF((Y27=0),0,(V27-W27)/Y27) -> 0.0 | Y27: 0.00 | Z27: 0.00
A28: 0 | B28: 0.00 | C28: 0.00 | D28: =SUM(B28,C28) -> 0.00 | E28: =IF((Y28=0),0,D28/Y28) -> 0.000 | F28: 0 | G28: 0 | H28: =SUM(F28,G28) -> 0 | I28: =IF((Y28=0),0,H28/Y28) -> 0.0 | J28: 0.00 | K28: 0.00 | L28: =SUM(J28,K28) -> 0.00 | M28: =IF((Y28=0),0,L28/Y28) -> 0.000 | N28: 0 | O28: 0 | P28: =SUM(N28,O28) -> 0 | Q28: =IF((Y28=0),0,P28/Y28) -> 0.0 | R28: 0 | S28: 0 | T28: 0 | U28: =IF((Y28=0),0,T28/Y28) -> 0.0 | V28: 0 | W28: 0 | X28: =IF((Y28=0),0,(V28-W28)/Y28) -> 0.0 | Y28: 0.00 | Z28: 0.00
A29: 0 | B29: 0.00 | C29: 0.00 | D29: =SUM(B29,C29) -> 0.00 | E29: =IF((Y29=0),0,D29/Y29) -> 0.000 | F29: 0 | G29: 0 | H29: =SUM(F29,G29) -> 0 | I29: =IF((Y29=0),0,H29/Y29) -> 0.0 | J29: 0.00 | K29: 0.00 | L29: =SUM(J29,K29) -> 0.00 | M29: =IF((Y29=0),0,L29/Y29) -> 0.000 | N29: 0 | O29: 0 | P29: =SUM(N29,O29) -> 0 | Q29: =IF((Y29=0),0,P29/Y29) -> 0.0 | R29: 0 | S29: 0 | T29: 0 | U29: =IF((Y29=0),0,T29/Y29) -> 0.0 | V29: 0 | W29: 0 | X29: =IF((Y29=0),0,(V29-W29)/Y29) -> 0.0 | Y29: 0.00 | Z29: 0.00
A30: 0 | B30: 0.00 | C30: 0.00 | D30: =SUM(B30,C30) -> 0.00 | E30: =IF((Y30=0),0,D30/Y30) -> 0.000 | F30: 0 | G30: 0 | H30: =SUM(F30,G30) -> 0 | I30: =IF((Y30=0),0,H30/Y30) -> 0.0 | J30: 0.00 | K30: 0.00 | L30: =SUM(J30,K30) -> 0.00 | M30: =IF((Y30=0),0,L30/Y30) -> 0.000 | N30: 0 | O30: 0 | P30: =SUM(N30,O30) -> 0 | Q30: =IF((Y30=0),0,P30/Y30) -> 0.0 | R30: 0 | S30: 0 | T30: 0 | U30: =IF((Y30=0),0,T30/Y30) -> 0.0 | V30: 0 | W30: 0 | X30: =IF((Y30=0),0,(V30-W30)/Y30) -> 0.0 | Y30: 0.00 | Z30: 0.00
A31: 0 | B31: 0.00 | C31: 0.00 | D31: =SUM(B31,C31) -> 0.00 | E31: =IF((Y31=0),0,D31/Y31) -> 0.000 | F31: 0 | G31: 0 | H31: =SUM(F31,G31) -> 0 | I31: =IF((Y31=0),0,H31/Y31) -> 0.0 | J31: 0.00 | K31: 0.00 | L31: =SUM(J31,K31) -> 0.00 | M31: =IF((Y31=0),0,L31/Y31) -> 0.000 | N31: 0 | O31: 0 | P31: =SUM(N31,O31) -> 0 | Q31: =IF((Y31=0),0,P31/Y31) -> 0.0 | R31: 0 | S31: 0 | T31: 0 | U31: =IF((Y31=0),0,T31/Y31) -> 0.0 | V31: 0 | W31: 0 | X31: =IF((Y31=0),0,(V31-W31)/Y31) -> 0.0 | Y31: 0.00 | Z31: 0.00
A32: 0 | B32: 0.00 | C32: 0.00 | D32: =SUM(B32,C32) -> 0.00 | E32: =IF((Y32=0),0,D32/Y32) -> 0.000 | F32: 0 | G32: 0 | H32: =SUM(F32,G32) -> 0 | I32: =IF((Y32=0),0,H32/Y32) -> 0.0 | J32: 0.00 | K32: 0.00 | L32: =SUM(J32,K32) -> 0.00 | M32: =IF((Y32=0),0,L32/Y32) -> 0.000 | N32: 0 | O32: 0 | P32: =SUM(N32,O32) -> 0 | Q32: =IF((Y32=0),0,P32/Y32) -> 0.0 | R32: 0 | S32: 0 | T32: 0 | U32: =IF((Y32=0),0,T32/Y32) -> 0.0 | V32: 0 | W32: 0 | X32: =IF((Y32=0),0,(V32-W32)/Y32) -> 0.0 | Y32: 0.00 | Z32: 0.00
A33: 0 | B33: 0.00 | C33: 0.00 | D33: =SUM(B33,C33) -> 0.00 | E33: =IF((Y33=0),0,D33/Y33) -> 0.000 | F33: 0 | G33: 0 | H33: =SUM(F33,G33) -> 0 | I33: =IF((Y33=0),0,H33/Y33) -> 0.0 | J33: 0.00 | K33: 0.00 | L33: =SUM(J33,K33) -> 0.00 | M33: =IF((Y33=0),0,L33/Y33) -> 0.000 | N33: 0 | O33: 0 | P33: =SUM(N33,O33) -> 0 | Q33: =IF((Y33=0),0,P33/Y33) -> 0.0 | R33: 0 | S33: 0 | T33: 0 | U33: =IF((Y33=0),0,T33/Y33) -> 0.0 | V33: 0 | W33: 0 | X33: =IF((Y33=0),0,(V33-W33)/Y33) -> 0.0 | Y33: 0.00 | Z33: 0.00
A34: 0 | B34: 0.00 | C34: 0.00 | D34: =SUM(B34,C34) -> 0.00 | E34: =IF((Y34=0),0,D34/Y34) -> 0.000 | F34: 0 | G34: 0 | H34: =SUM(F34,G34) -> 0 | I34: =IF((Y34=0),0,H34/Y34) -> 0.0 | J34: 0.00 | K34: 0.00 | L34: =SUM(J34,K34) -> 0.00 | M34: =IF((Y34=0),0,L34/Y34) -> 0.000 | N34: 0 | O34: 0 | P34: =SUM(N34,O34) -> 0 | Q34: =IF((Y34=0),0,P34/Y34) -> 0.0 | R34: 0 | S34: 0 | T34: 0 | U34: =IF((Y34=0),0,T34/Y34) -> 0.0 | V34: 0 | W34: 0 | X34: =IF((Y34=0),0,(V34-W34)/Y34) -> 0.0 | Y34: 0.00 | Z34: 0.00
A35: 0 | B35: 0.00 | C35: 0.00 | D35: =SUM(B35,C35) -> 0.00 | E35: =IF((Y35=0),0,D35/Y35) -> 0.000 | F35: 0 | G35: 0 | H35: =SUM(F35,G35) -> 0 | I35: =IF((Y35=0),0,H35/Y35) -> 0.0 | J35: 0.00 | K35: 0.00 | L35: =SUM(J35,K35) -> 0.00 | M35: =IF((Y35=0),0,L35/Y35) -> 0.000 | N35: 0 | O35: 0 | P35: =SUM(N35,O35) -> 0 | Q35: =IF((Y35=0),0,P35/Y35) -> 0.0 | R35: 0 | S35: 0 | T35: 0 | U35: =IF((Y35=0),0,T35/Y35) -> 0.0 | V35: 0 | W35: 0 | X35: =IF((Y35=0),0,(V35-W35)/Y35) -> 0.0 | Y35: 0.00 | Z35: 0.00
A36: 0 | B36: 0.00 | C36: 0.00 | D36: =SUM(B36,C36) -> 0.00 | E36: =IF((Y36=0),0,D36/Y36) -> 0.000 | F36: 0 | G36: 0 | H36: =SUM(F36,G36) -> 0 | I36: =IF((Y36=0),0,H36/Y36) -> 0.0 | J36: 0.00 | K36: 0.00 | L36: =SUM(J36,K36) -> 0.00 | M36: =IF((Y36=0),0,L36/Y36) -> 0.000 | N36: 0 | O36: 0 | P36: =SUM(N36,O36) -> 0 | Q36: =IF((Y36=0),0,P36/Y36) -> 0.0 | R36: 0 | S36: 0 | T36: 0 | U36: =IF((Y36=0),0,T36/Y36) -> 0.0 | V36: 0 | W36: 0 | X36: =IF((Y36=0),0,(V36-W36)/Y36) -> 0.0 | Y36: 0.00 | Z36: 0.00
A37: 0 | B37: 0.00 | C37: 0.00 | D37: =SUM(B37,C37) -> 0.00 | E37: =IF((Y37=0),0,D37/Y37) -> 0.000 | F37: 0 | G37: 0 | H37: =SUM(F37,G37) -> 0 | I37: =IF((Y37=0),0,H37/Y37) -> 0.0 | J37: 0.00 | K37: 0.00 | L37: =SUM(J37,K37) -> 0.00 | M37: =IF((Y37=0),0,L37/Y37) -> 0.000 | N37: 0 | O37: 0 | P37: =SUM(N37,O37) -> 0 | Q37: =IF((Y37=0),0,P37/Y37) -> 0.0 | R37: 0 | S37: 0 | T37: 0 | U37: =IF((Y37=0),0,T37/Y37) -> 0.0 | V37: 0 | W37: 0 | X37: =IF((Y37=0),0,(V37-W37)/Y37) -> 0.0 | Y37: 0.00 | Z37: 0.00
A38: 0 | B38: 0.00 | C38: 0.00 | D38: =SUM(B38,C38) -> 0.00 | E38: =IF((Y38=0),0,D38/Y38) -> 0.000 | F38: 0 | G38: 0 | H38: =SUM(F38,G38) -> 0 | I38: =IF((Y38=0),0,H38/Y38) -> 0.0 | J38: 0.00 | K38: 0.00 | L38: =SUM(J38,K38) -> 0.00 | M38: =IF((Y38=0),0,L38/Y38) -> 0.000 | N38: 0 | O38: 0 | P38: =SUM(N38,O38) -> 0 | Q38: =IF((Y38=0),0,P38/Y38) -> 0.0 | R38: 0 | S38: 0 | T38: 0 | U38: =IF((Y38=0),0,T38/Y38) -> 0.0 | V38: 0 | W38: 0 | X38: =IF((Y38=0),0,(V38-W38)/Y38) -> 0.0 | Y38: 0.00 | Z38: 0.00
A39: 0 | B39: 0.00 | C39: 0.00 | D39: =SUM(B39,C39) -> 0.00 | E39: =IF((Y39=0),0,D39/Y39) -> 0.000 | F39: 0 | G39: 0 | H39: =SUM(F39,G39) -> 0 | I39: =IF((Y39=0),0,H39/Y39) -> 0.0 | J39: 0.00 | K39: 0.00 | L39: =SUM(J39,K39) -> 0.00 | M39: =IF((Y39=0),0,L39/Y39) -> 0.000 | N39: 0 | O39: 0 | P39: =SUM(N39,O39) -> 0 | Q39: =IF((Y39=0),0,P39/Y39) -> 0.0 | R39: 0 | S39: 0 | T39: 0 | U39: =IF((Y39=0),0,T39/Y39) -> 0.0 | V39: 0 | W39: 0 | X39: =IF((Y39=0),0,(V39-W39)/Y39) -> 0.0 | Y39: 0.00 | Z39: 0.00
A40: 0 | B40: 0.00 | C40: 0.00 | D40: =SUM(B40,C40) -> 0.00 | E40: =IF((Y40=0),0,D40/Y40) -> 0.000 | F40: 0 | G40: 0 | H40: =SUM(F40,G40) -> 0 | I40: =IF((Y40=0),0,H40/Y40) -> 0.0 | J40: 0.00 | K40: 0.00 | L40: =SUM(J40,K40) -> 0.00 | M40: =IF((Y40=0),0,L40/Y40) -> 0.000 | N40: 0 | O40: 0 | P40: =SUM(N40,O40) -> 0 | Q40: =IF((Y40=0),0,P40/Y40) -> 0.0 | R40: 0 | S40: 0 | T40: 0 | U40: =IF((Y40=0),0,T40/Y40) -> 0.0 | V40: 0 | W40: 0 | X40: =IF((Y40=0),0,(V40-W40)/Y40) -> 0.0 | Y40: 0.00 | Z40: 0.00
A41: 0 | B41: 0.00 | C41: 0.00 | D41: =SUM(B41,C41) -> 0.00 | E41: =IF((Y41=0),0,D41/Y41) -> 0.000 | F41: 0 | G41: 0 | H41: =SUM(F41,G41) -> 0 | I41: =IF((Y41=0),0,H41/Y41) -> 0.0 | J41: 0.00 | K41: 0.00 | L41: =SUM(J41,K41) -> 0.00 | M41: =IF((Y41=0),0,L41/Y41) -> 0.000 | N41: 0 | O41: 0 | P41: =SUM(N41,O41) -> 0 | Q41: =IF((Y41=0),0,P41/Y41) -> 0.0 | R41: 0 | S41: 0 | T41: 0 | U41: =IF((Y41=0),0,T41/Y41) -> 0.0 | V41: 0 | W41: 0 | X41: =IF((Y41=0),0,(V41-W41)/Y41) -> 0.0 | Y41: 0.00 | Z41: 0.00
A42: Всего: | B42: =SUM(B11:B41) -> 367.80399322509766 | C42: =SUM(C11:C41) -> 1064.0020904541016 | D42: =SUM(D11:D41) -> 1431.8060836791992 | E42: =IF((Y42=0),0,D42/Y42) -> 0.29690494486035501 | F42: =SUM(F11:F41) -> 158975.99588012695 | G42: =SUM(G11:G41) -> 371608.21533203125 | H42: =SUM(H11:H41) -> 530584.2112121582 | I42: =IF((Y42=0),0,H42/Y42) -> 110.02403032743125 | J42: =SUM(J11:J41) -> 1349.768940673828 | K42: =SUM(K11:K41) -> 3536.2315368652344 | L42: =SUM(L11:L41) -> 4886.0004775390626 | M42: =IF((Y42=0),0,L42/Y42) -> 1.0131802895010136 | N42: =SUM(N11:N41) -> 3845.9999008178711 | O42: =SUM(O11:O41) -> 8724.076509475708 | P42: =SUM(P11:P41) -> 12570.076410293579 | Q42: =IF((Y42=0),0,P42/Y42) -> 2.6065805181512673 | R42: =SUM(R11:R41) -> 0.0 | S42: =SUM(S11:S41) -> 536670.04655301571 | T42: =SUM(T11:T41) -> 923569 | U42: =IF((Y42=0),0,T42/Y42) -> 191.51490285270455 | V42: =SUM(V11:V41) -> 270751.45218749996 | W42: =SUM(W11:W41) -> 36935 | X42: =IF((Y42=0),0,(V42-W42)/Y42) -> 48.485099787945558 | Y42: =SUM(Y11:Y41) -> 4822.4393310546875 | Z42: =SUM(Z11:Z41) -> 4828.8299560546875
A43: Максимум: | B43: =MAX(B11:B41) -> 93.250991821289063 | C43: =MAX(C11:C41) -> 276.31861877441406 | D43: =MAX(D11:D41) -> 369.56961059570312 | E43: =MAX(E11:E41) -> 0.30006803966999013 | F43: =MAX(F11:F41) -> 32107.997894287109 | G43: =MAX(G11:G41) -> 94347.984313964844 | H43: =MAX(H11:H41) -> 126455.98220825195 | I43: =MAX(I11:I41) -> 105.67969032041465 | J43: =MAX(J11:J41) -> 278.20196533203125 | K43: =MAX(K11:K41) -> 895.51266479492187 | L43: =MAX(L11:L41) -> 1169.3804016113281 | M43: =MAX(M11:M41) -> 0.9787517887241679 | N43: =MAX(N11:N41) -> 776.99995040893555 | O43: =MAX(O11:O41) -> 2319.2465305328369 | P43: =MAX(P11:P41) -> 3096.2464809417725 | Q43: =MAX(Q11:Q41) -> 2.4780062947386776 | R43: =MAX(R11:R41) -> 0.0 | S43: =MAX(S11:S41) -> 134335.73505282402 | T43: =MAX(T11:T41) -> 232675 | U43: =MAX(U11:U41) -> 197.09619485587456 | V43: =MAX(V11:V41) -> 57581.17 | W43: =MAX(W11:W41) -> 7387.0 | X43: =MAX(X11:X41) -> 41.432050168805645 | Y43: =MAX(Y11:Y41) -> 1249.490966796875 | Z43: =MAX(Z11:Z41) -> 1246.8699951171875
A44: Среднее: | B44: 73.560798645019531 | C44: 212.8004180908203 | D44: 286.36121673583983 | E44: 0.23755170212368704 | F44: 31795.199176025391 | G44: 74321.64306640625 | H44: 106116.84224243164 | I44: 82.784644825607543 | J44: 269.9537881347656 | K44: 707.24630737304687 | L44: 977.20009550781253 | M44: 0.76749670243014589 | N44: 769.1999801635742 | O44: 1744.8153018951416 | P44: 2514.0152820587159 | Q44: 1.9590626212508404 | R44: 0 | S44: 107334.00931060314 | T44: 184713.8 | U44: 153.30770511373362 | V44: 54150.290437499993 | W44: 7387.0 | X44: 30.490560894721035 | Y44: 964.48786621093745 | Z44: 965.7659912109375
A45: Минимум: | B45: =MIN(B11:B41) -> 0.00 | C45: =MIN(C11:C41) -> 0.00 | D45: =MIN(D11:D41) -> 0.00 | E45: =MIN(E11:E41) -> 0.000 | F45: =MIN(F11:F41) -> 0 | G45: =MIN(G11:G41) -> 0 | H45: =MIN(H11:H41) -> 0 | I45: =MIN(I11:I41) -> 0.0 | J45: =MIN(J11:J41) -> 0.00 | K45: =MIN(K11:K41) -> 0.00 | L45: =MIN(L11:L41) -> 0.00 | M45: =MIN(M11:M41) -> 0.000 | N45: =MIN(N11:N41) -> 0 | O45: =MIN(O11:O41) -> 0 | P45: =MIN(P11:P41) -> 0 | Q45: =MIN(Q11:Q41) -> 0.0 | R45: =MIN(R11:R41) -> 0.0 | S45: =MIN(S11:S41) -> 0 | T45: =MIN(T11:T41) -> 0 | U45: =MIN(U11:U41) -> 0.0 | V45: =MIN(V11:V41) -> 0.0 | W45: =MIN(W11:W41) -> 0.0 | X45: =MIN(X11:X41) -> 0.0 | Y45: =MIN(Y11:Y41) -> 0.00 | Z45: =MIN(Z11:Z41) -> 0.00
A50: Ст.мастер смены:
A54: =NOW() -> 41645.429985069444