A1: data period - from: 2014-01-01 00:00:00 to: 2014-01-06 10:10:49
A3: ЦЕХ М-5
A5: МЕСЯЧНЫЙ БАЛАНС ПОТРЕБЛЕНИЯ NH3 (т/сут)
B7: отделение 1 | E7: отделение 2 | H7: по цеху | J7: по потребителям | K7: по АСМ
A8: Время | B8: NH3 Ж | C8: NH3 ГА выдача | D8: NH3 ГА потреб. | E8: NH3 Ж | F8: NH3 ГА выдача | G8: NH3 ГА потреб. | H8: NH3 ГА потреб. | I8: Расх. коэф. План (0.298) | J8: HNO3 | K8: HNO3
A9: день | B9: т/сут | C9: т/сут | D9: т/сут | E9: т/сут | F9: т/сут | G9: т/сут | H9: т/сут | I9: 1 т.мнг | J9: т.мнг/сут | K9: т.мнг/сут
A11: 41640 | B11: 174.00 | C11: 80.00 | D11: =IF(((B11-C11)<0),0, B11-C11) -> 94.00 | E11: 355.83743286132812 | F11: 67.856117248535156 | G11: =E11-F11 -> 287.98131561279297 | H11: =D11+G11 -> 381.98131561279297 | I11: =IF((J11=0),0,H11/J11) -> 0.30570954553758706 | J11: 1249.490966796875 | K11: 1246.8699951171875
A12: 41641 | B12: 170.00 | C12: 77.00 | D12: =IF(((B12-C12)<0),0, B12-C12) -> 93.00 | E12: 344.28668212890625 | F12: 66.272994995117188 | G12: =E12-F12 -> 278.01368713378906 | H12: =D12+G12 -> 371.01368713378906 | I12: =IF((J12=0),0,H12/J12) -> 0.30680847153797919 | J12: 1209.26806640625 | K12: 1201.949951171875
A13: 41642 | B13: 180.00 | C13: 88.00 | D13: =IF(((B13-C13)<0),0, B13-C13) -> 92.00 | E13: 340.6944580078125 | F13: 64.093597412109375 | G13: =E13-F13 -> 276.60086059570312 | H13: =D13+G13 -> 368.60086059570312 | I13: =IF((J13=0),0,H13/J13) -> 0.31288956046347283 | J13: 1178.05419921875 | K13: 1185.9200439453125
A14: 41643 | B14: 189.00 | C14: 98.00 | D14: =IF(((B14-C14)<0),0, B14-C14) -> 91.00 | E14: 340.5062255859375 | F14: 63.834457397460938 | G14: =E14-F14 -> 276.67176818847656 | H14: =D14+G14 -> 367.67176818847656 | I14: =IF((J14=0),0,H14/J14) -> 0.31010768792324317 | J14: 1185.6260986328125 | K14: 1194.0899658203125
A15: 41644 | B15: 188.00 | C15: 98.00 | D15: =IF(((B15-C15)<0),0, B15-C15) -> 90.00 | E15: 0.00 | F15: 0.00 | G15: =E15-F15 -> 0.00 | H15: =D15+G15 -> 90.000 | I15: =IF((J15=0),0,H15/J15) -> 0.000 | J15: 0.00 | K15: 0.00
A16: 41645 | B16: 0.00 | C16: 0.00 | D16: =IF(((B16-C16)<0),0, B16-C16) -> 0.00 | E16: 0.00 | F16: 0.00 | G16: =E16-F16 -> 0.00 | H16: =D16+G16 -> 0.000 | I16: =IF((J16=0),0,H16/J16) -> 0.000 | J16: 0.00 | K16: 0.00
A17: 0 | B17: 0.00 | C17: 0.00 | D17: =IF(((B17-C17)<0),0, B17-C17) -> 0.00 | E17: 0.00 | F17: 0.00 | G17: =E17-F17 -> 0.00 | H17: =D17+G17 -> 0.000 | I17: =IF((J17=0),0,H17/J17) -> 0.000 | J17: 0.00 | K17: 0.00
A18: 0 | B18: 0.00 | C18: 0.00 | D18: =IF(((B18-C18)<0),0, B18-C18) -> 0.00 | E18: 0.00 | F18: 0.00 | G18: =E18-F18 -> 0.00 | H18: =D18+G18 -> 0.000 | I18: =IF((J18=0),0,H18/J18) -> 0.000 | J18: 0.00 | K18: 0.00
A19: 0 | B19: 0.00 | C19: 0.00 | D19: =IF(((B19-C19)<0),0, B19-C19) -> 0.00 | E19: 0.00 | F19: 0.00 | G19: =E19-F19 -> 0.00 | H19: =D19+G19 -> 0.000 | I19: =IF((J19=0),0,H19/J19) -> 0.000 | J19: 0.00 | K19: 0.00
A20: 0 | B20: 0.00 | C20: 0.00 | D20: =IF(((B20-C20)<0),0, B20-C20) -> 0.00 | E20: 0.00 | F20: 0.00 | G20: =E20-F20 -> 0.00 | H20: =D20+G20 -> 0.000 | I20: =IF((J20=0),0,H20/J20) -> 0.000 | J20: 0.00 | K20: 0.00
A21: 0 | B21: 0.00 | C21: 0.00 | D21: =IF(((B21-C21)<0),0, B21-C21) -> 0.00 | E21: 0.00 | F21: 0.00 | G21: =E21-F21 -> 0.00 | H21: =D21+G21 -> 0.000 | I21: =IF((J21=0),0,H21/J21) -> 0.000 | J21: 0.00 | K21: 0.00
A22: 0 | B22: 0.00 | C22: 0.00 | D22: =IF(((B22-C22)<0),0, B22-C22) -> 0.00 | E22: 0.00 | F22: 0.00 | G22: =E22-F22 -> 0.00 | H22: =D22+G22 -> 0.000 | I22: =IF((J22=0),0,H22/J22) -> 0.000 | J22: 0.00 | K22: 0.00
A23: 0 | B23: 0.00 | C23: 0.00 | D23: =IF(((B23-C23)<0),0, B23-C23) -> 0.00 | E23: 0.00 | F23: 0.00 | G23: =E23-F23 -> 0.00 | H23: =D23+G23 -> 0.000 | I23: =IF((J23=0),0,H23/J23) -> 0.000 | J23: 0.00 | K23: 0.00
A24: 0 | B24: 0.00 | C24: 0.00 | D24: =IF(((B24-C24)<0),0, B24-C24) -> 0.00 | E24: 0.00 | F24: 0.00 | G24: =E24-F24 -> 0.00 | H24: =D24+G24 -> 0.000 | I24: =IF((J24=0),0,H24/J24) -> 0.000 | J24: 0.00 | K24: 0.00
A25: 0 | B25: 0.00 | C25: 0.00 | D25: =IF(((B25-C25)<0),0, B25-C25) -> 0.00 | E25: 0.00 | F25: 0.00 | G25: =E25-F25 -> 0.00 | H25: =D25+G25 -> 0.000 | I25: =IF((J25=0),0,H25/J25) -> 0.000 | J25: 0.00 | K25: 0.00
A26: 0 | B26: 0.00 | C26: 0.00 | D26: =IF(((B26-C26)<0),0, B26-C26) -> 0.00 | E26: 0.00 | F26: 0.00 | G26: =E26-F26 -> 0.00 | H26: =D26+G26 -> 0.000 | I26: =IF((J26=0),0,H26/J26) -> 0.000 | J26: 0.00 | K26: 0.00
A27: 0 | B27: 0.00 | C27: 0.00 | D27: =IF(((B27-C27)<0),0, B27-C27) -> 0.00 | E27: 0.00 | F27: 0.00 | G27: =E27-F27 -> 0.00 | H27: =D27+G27 -> 0.000 | I27: =IF((J27=0),0,H27/J27) -> 0.000 | J27: 0.00 | K27: 0.00
A28: 0 | B28: 0.00 | C28: 0.00 | D28: =IF(((B28-C28)<0),0, B28-C28) -> 0.00 | E28: 0.00 | F28: 0.00 | G28: =E28-F28 -> 0.00 | H28: =D28+G28 -> 0.000 | I28: =IF((J28=0),0,H28/J28) -> 0.000 | J28: 0.00 | K28: 0.00
A29: 0 | B29: 0.00 | C29: 0.00 | D29: =IF(((B29-C29)<0),0, B29-C29) -> 0.00 | E29: 0.00 | F29: 0.00 | G29: =E29-F29 -> 0.00 | H29: =D29+G29 -> 0.000 | I29: =IF((J29=0),0,H29/J29) -> 0.000 | J29: 0.00 | K29: 0.00
A30: 0 | B30: 0.00 | C30: 0.00 | D30: =IF(((B30-C30)<0),0, B30-C30) -> 0.00 | E30: 0.00 | F30: 0.00 | G30: =E30-F30 -> 0.00 | H30: =D30+G30 -> 0.000 | I30: =IF((J30=0),0,H30/J30) -> 0.000 | J30: 0.00 | K30: 0.00
A31: 0 | B31: 0.00 | C31: 0.00 | D31: =IF(((B31-C31)<0),0, B31-C31) -> 0.00 | E31: 0.00 | F31: 0.00 | G31: =E31-F31 -> 0.00 | H31: =D31+G31 -> 0.000 | I31: =IF((J31=0),0,H31/J31) -> 0.000 | J31: 0.00 | K31: 0.00
A32: 0 | B32: 0.00 | C32: 0.00 | D32: =IF(((B32-C32)<0),0, B32-C32) -> 0.00 | E32: 0.00 | F32: 0.00 | G32: =E32-F32 -> 0.00 | H32: =D32+G32 -> 0.000 | I32: =IF((J32=0),0,H32/J32) -> 0.000 | J32: 0.00 | K32: 0.00
A33: 0 | B33: 0.00 | C33: 0.00 | D33: =IF(((B33-C33)<0),0, B33-C33) -> 0.00 | E33: 0.00 | F33: 0.00 | G33: =E33-F33 -> 0.00 | H33: =D33+G33 -> 0.000 | I33: =IF((J33=0),0,H33/J33) -> 0.000 | J33: 0.00 | K33: 0.00
A34: 0 | B34: 0.00 | C34: 0.00 | D34: =IF(((B34-C34)<0),0, B34-C34) -> 0.00 | E34: 0.00 | F34: 0.00 | G34: =E34-F34 -> 0.00 | H34: =D34+G34 -> 0.000 | I34: =IF((J34=0),0,H34/J34) -> 0.000 | J34: 0.00 | K34: 0.00
A35: 0 | B35: 0.00 | C35: 0.00 | D35: =IF(((B35-C35)<0),0, B35-C35) -> 0.00 | E35: 0.00 | F35: 0.00 | G35: =E35-F35 -> 0.00 | H35: =D35+G35 -> 0.000 | I35: =IF((J35=0),0,H35/J35) -> 0.000 | J35: 0.00 | K35: 0.00
A36: 0 | B36: 0.00 | C36: 0.00 | D36: =IF(((B36-C36)<0),0, B36-C36) -> 0.00 | E36: 0.00 | F36: 0.00 | G36: =E36-F36 -> 0.00 | H36: =D36+G36 -> 0.000 | I36: =IF((J36=0),0,H36/J36) -> 0.000 | J36: 0.00 | K36: 0.00
A37: 0 | B37: 0.00 | C37: 0.00 | D37: =IF(((B37-C37)<0),0, B37-C37) -> 0.00 | E37: 0.00 | F37: 0.00 | G37: =E37-F37 -> 0.00 | H37: =D37+G37 -> 0.000 | I37: =IF((J37=0),0,H37/J37) -> 0.000 | J37: 0.00 | K37: 0.00
A38: 0 | B38: 0.00 | C38: 0.00 | D38: =IF(((B38-C38)<0),0, B38-C38) -> 0.00 | E38: 0.00 | F38: 0.00 | G38: =E38-F38 -> 0.00 | H38: =D38+G38 -> 0.000 | I38: =IF((J38=0),0,H38/J38) -> 0.000 | J38: 0.00 | K38: 0.00
A39: 0 | B39: 0.00 | C39: 0.00 | D39: =IF(((B39-C39)<0),0, B39-C39) -> 0.00 | E39: 0.00 | F39: 0.00 | G39: =E39-F39 -> 0.00 | H39: =D39+G39 -> 0.000 | I39: =IF((J39=0),0,H39/J39) -> 0.000 | J39: 0.00 | K39: 0.00
A40: 0 | B40: 0.00 | C40: 0.00 | D40: =IF(((B40-C40)<0),0, B40-C40) -> 0.00 | E40: 0.00 | F40: 0.00 | G40: =E40-F40 -> 0.00 | H40: =D40+G40 -> 0.000 | I40: =IF((J40=0),0,H40/J40) -> 0.000 | J40: 0.00 | K40: 0.00
A41: 0 | B41: 0.00 | C41: 0.00 | D41: =IF(((B41-C41)<0),0, B41-C41) -> 0.00 | E41: 0.00 | F41: 0.00 | G41: =E41-F41 -> 0.00 | H41: =D41+G41 -> 0.000 | I41: =IF((J41=0),0,H41/J41) -> 0.000 | J41: 0.00 | K41: 0.00
A42: Всего: | B42: =SUM(B11:B41) -> 901.00 | C42: =SUM(C11:C41) -> 441.00 | D42: =SUM(D11:D41) -> 460.00 | E42: =SUM(E11:E41) -> 1381.3247985839844 | F42: =SUM(F11:F41) -> 262.05716705322266 | G42: =SUM(G11:G41) -> 1119.2676315307617 | H42: =SUM(H11:H41) -> 1579.2676315307617 | I42: =IF((K42=0),0,H42/J42) -> 0.32748315180677851 | J42: =SUM(J11:J41) -> 4822.4393310546875 | K42: =SUM(K11:K41) -> 4828.8299560546875
A43: Максимум: | B43: =MAX(B11:B41) -> 189.00 | C43: =MAX(C11:C41) -> 98.00 | D43: =MAX(D11:D41) -> 94.00 | E43: =MAX(E11:E41) -> 355.83743286132812 | F43: =MAX(F11:F41) -> 67.856117248535156 | G43: =MAX(G11:G41) -> 287.98131561279297 | H43: =MAX(H11:H41) -> 381.98131561279297 | I43: =MAX(I11:I41) -> 0.31288956046347283 | J43: =MAX(J11:J41) -> 1249.490966796875 | K43: =MAX(K11:K41) -> 1246.8699951171875
A44: Среднее: | B44: 180.20 | C44: 88.20 | D44: 92.00 | E44: 276.26495971679685 | F44: 52.411433410644534 | G44: 223.85352630615233 | H44: 315.85352630615233 | I44: 0.24710305309245645 | J44: 964.48786621093745 | K44: 965.7659912109375
A45: Минимум: | B45: =MIN(B11:B41) -> 0.00 | C45: =MIN(C11:C41) -> 0.00 | D45: =MIN(D11:D41) -> 0.00 | E45: =MIN(E11:E41) -> 0.00 | F45: =MIN(F11:F41) -> 0.00 | G45: =MIN(G11:G41) -> 0.00 | H45: =MIN(H11:H41) -> 0.000 | I45: =MIN(I11:I41) -> 0.000 | J45: =MIN(J11:J41) -> 0.00 | K45: =MIN(K11:K41) -> 0.00
A50: Ст.мастер смены: | H50: /___________________/
A54: =NOW() -> 41645.424308449074