A1: data period - from: 2014-01-05 00:00 to: 2014-01-06 00:00:00
A3: ЦЕХ М-5 | B3: отд. №2
A4: СУТОЧНЫЙ ОТЧЕТ ПО ХОЗУЧЕТНЫМ ПАРАМЕТРАМ
B5: ВЫРАБОТКА
A7: Время | B7: Выдача ГА | C7: Выдача ПАРА (1коллектор) | E7: Выдача ПАРА (2коллектор)
B8: FIR-4 | C8: FIR-2/1 | E8: FIR-2/2
A9: час. | B9: тонн | C9: тонн | D9: ГКал. | E9: тонн | F9: ГКал.
A11: 41644.041666666664 | B11: 2.6668429374694824 | C11: 27.575447082519531 | D11: 18.938741683959961 | E11: 27.918121337890625 | F11: 19.181421279907227
A12: 41644.083333333336 | B12: 2.6392459869384766 | C12: 27.752292633056641 | D12: 19.062295913696289 | E12: 28.09515380859375 | F12: 19.303396224975586
A13: 41644.125 | B13: 2.6273036003112793 | C13: 27.681438446044922 | D13: 19.012226104736328 | E13: 28.05364990234375 | F13: 19.275020599365234
A14: 41644.166666666664 | B14: 2.6531896591186523 | C14: 27.776527404785156 | D14: 19.075496673583984 | E14: 28.1282958984375 | F14: 19.322597503662109
A15: 41644.208333333336 | B15: 2.6291017532348633 | C15: 27.676071166992187 | D15: 19.005416870117188 | E15: 28.031600952148437 | F15: 19.255744934082031
A16: 41644.25 | B16: 2.6418113708496094 | C16: 27.722671508789063 | D16: 19.039024353027344 | E16: 28.077346801757813 | F16: 19.289276123046875
A17: 41644.291666666664 | B17: 2.6548929214477539 | C17: 27.821762084960938 | D17: 19.108970642089844 | E17: 28.15960693359375 | F17: 19.345382690429687
A18: 41644.333333333336 | B18: 2.6163864135742187 | C18: 27.7196044921875 | D18: 19.03814697265625 | E18: 28.034637451171875 | F18: 19.259414672851563
A19: 41644.375 | B19: 2.6281261444091797 | C19: 28.078262329101563 | D19: 19.280166625976563 | E19: 28.368118286132813 | F19: 19.484970092773438
A20: 41644.416666666664 | B20: 2.6177043914794922 | C20: 27.939361572265625 | D20: 19.1854248046875 | E20: 28.255538940429688 | F20: 19.40411376953125
A21: 41644.458333333336 | B21: 2.6086444854736328 | C21: 27.347747802734375 | D21: 18.780471801757812 | E21: 27.74407958984375 | F21: 19.056320190429688
A22: 41644.5 | B22: 2.6237220764160156 | C22: 27.593994140625 | D22: 18.949432373046875 | E22: 27.902496337890625 | F22: 19.166702270507813
A23: 41644.541666666664 | B23: 2.6100616455078125 | C23: 27.611328125 | D23: 18.961746215820312 | E23: 27.92535400390625 | F23: 19.181777954101562
A24: 41644.583333333336 | B24: 2.5974845886230469 | C24: 27.489471435546875 | D24: 18.8797607421875 | E24: 27.830413818359375 | F24: 19.116928100585937
A25: 41644.625 | B25: 2.6243705749511719 | C25: 27.710968017578125 | D25: 19.0308837890625 | E25: 28.05426025390625 | F25: 19.2728271484375
A26: 41644.666666666664 | B26: 2.5950393676757812 | C26: 28.290283203125 | D26: 19.431488037109375 | E26: 28.494598388671875 | F26: 19.576904296875
A27: 41644.708333333336 | B27: 2.6052703857421875 | C27: 28.436309814453125 | D27: 19.530487060546875 | E27: 28.616058349609375 | F27: 19.657745361328125
A28: 41644.75 | B28: 2.60260009765625 | C28: 28.421234130859375 | D28: 19.5194091796875 | E28: 28.593170166015625 | F28: 19.639892578125
A29: 41644.791666666664 | B29: 2.6143150329589844 | C29: 27.89019775390625 | D29: 19.1571044921875 | E29: 28.106597900390625 | F29: 19.3084716796875
A30: 41644.833333333336 | B30: 2.5874519348144531 | C30: 28.08087158203125 | D30: 19.289825439453125 | E30: 28.26385498046875 | F30: 19.4185791015625
A31: 41644.875 | B31: 2.5786247253417969 | C31: 28.04510498046875 | D31: 19.263702392578125 | E31: 28.30523681640625 | F31: 19.444305419921875
A32: 41644.916666666664 | B32: 2.5810432434082031 | C32: 26.79510498046875 | D32: 18.41650390625 | E32: 27.5699462890625 | F32: 18.939605712890625
A33: 41644.958333333336 | B33: 2.5816497802734375 | C33: 27.04345703125 | D33: 18.5865478515625 | E33: 27.76971435546875 | F33: 19.074951171875
A34: 41645 | B34: 2.5635719299316406 | C34: 27.1982421875 | D34: 18.6923828125 | E34: 27.80267333984375 | F34: 19.098236083984375
A35: Суточный: | B35: =SUM(B11:B34) -> 62.748455047607422 | C35: =SUM(C11:C34) -> 665.69775390625 | D35: =SUM(D11:D34) -> 457.23565673828125 | E35: =SUM(E11:E34) -> 674.10052490234375 | F35: =SUM(F11:F34) -> 463.0745849609375
A40: Ст.мастер смены: | C40: ___________ | D40: /___________________/
A44: =NOW() -> 41645.000956481483