A1: data period - from: 2014-01-01 00:00:00 to: 2014-01-06 00:07:15
A3: ЦЕХ М-5
A5: МЕСЯЧНЫЙ БАЛАНС ПОТРЕБЛЕНИЯ NH3 (т/сут) И ВЫРАБОТКИ HNO3 (т/сут)
B7: отделение 1 | K7: отделение 2 | AJ7: по потребителям | AK7: по АСМ
A8: Время | B8: AGR 1/1 | E8: Агр 2/1 | H8: Агр 3/1 | K8: Агр 1/2 | N8: Агр 2/2 | Q8: Агр 3/2 | T8: Агр 4/2 | W8: Агр 5/2 | Z8: Агр 6/2 | AC8: Агр 7/2 | AF8: Сумма NH3 | AG8: Сумма HNO3 | AH8: Расх. коэф. План (0.298) | AI8: Расх. коэф. потрб План (0.298) | AJ8: HNO3 | AK8: HNO3
B9: NH3 | C9: HNO3 | D9: Расх. коэф. План (0.298) | E9: NH3 | F9: HNO3 | G9: Расх. коэф. План (0.298) | H9: NH3 | I9: HNO3 | J9: Расх. коэф. План (0.298) | K9: NH3 | L9: HNO3 | M9: Расх. коэф. План (0.298) | N9: NH3 | O9: HNO3 | P9: Расх. коэф. План (0.298) | Q9: NH3 | R9: HNO3 | S9: Расх. коэф. План (0.298) | T9: NH3 | U9: HNO3 | V9: Расх. коэф. План (0.298) | W9: NH3 | X9: HNO3 | Y9: Расх. коэф. План (0.298) | Z9: NH3 | AA9: HNO3 | AB9: Расх. коэф. План (0.298) | AC9: NH3 | AD9: HNO3 | AE9: Расх. коэф. План (0.298)
A10: день | B10: т/сут | C10: т/сут | D10: 1 т.мнг | E10: т/сут | F10: т/сут | G10: 1 т.мнг | H10: т/сут | I10: т/сут | J10: 1 т.мнг | K10: т/сут | L10: т/сут | M10: 1 т.мнг | N10: т/сут | O10: т/сут | P10: 1 т.мнг | Q10: т/сут | R10: т/сут | S10: 1 т.мнг | T10: т/сут | U10: т/сут | V10: 1 т.мнг | W10: т/сут | X10: т/сут | Y10: 1 т.мнг | Z10: т/сут | AA10: т/сут | AB10: 1 т.мнг | AC10: т/сут | AD10: т/сут | AE10: 1 т.мнг | AF10: т/сут | AG10: т/сут | AH10: 1 т.мнг | AI10: 1 т.мнг | AJ10: т.мнг/сут | AK10: т.мнг/сут
A12: 41640 | B12: 0.000 | C12: 0.000 | D12: =IF((C12<1),0,B12/C12) -> 0.000 | E12: 0.000 | F12: 0.000 | G12: =IF((F12<1),0,E12/F12) -> 0.000 | H12: 93.250991821289063 | I12: 317.1300048828125 | J12: =IF((I12<1),0,H12/I12) -> 0.29404657517584198 | K12: 88.820335388183594 | L12: 317.4217529296875 | M12: =IF((L12<1),0,K12/L12) -> 0.27981804828561418 | N12: 0.000 | O12: 1.0000000000000001E-5 | P12: =IF((O12<1),0,N12/O12) -> 0.000 | Q12: 92.997184753417969 | R12: 294.15304565429687 | S12: =IF((R12<1),0,Q12/R12) -> 0.31615237757120773 | T12: 0.000 | U12: 0.000 | V12: =IF((U12<1),0,T12/U12) -> 0.000 | W12: 0.000 | X12: 0.45844897627830505 | Y12: =IF((X12<1),0,W12/X12) -> 0.000 | Z12: 94.5010986328125 | AA12: 321.248046875 | AB12: =IF((AA12<1),0,Z12/AA12) -> 0.29416863246979857 | AC12: 0.000 | AD12: 0.27107289433479309 | AE12: =IF((AD12<1),0,AC12/AD12) -> 0.000 | AF12: =SUM(B12,E12,H12,K12,N12,Q12,T12,W12,Z12,AC12) -> 369.56961059570312 | AG12: =SUM(C12,F12,I12,L12,O12,R12,U12,X12,AA12,AD12) -> 1250.6823822124099 | AH12: =IF((AJ12=0),0,AF12/AG12) -> 0.29549437639150911 | AI12: =IF((AJ12=0),0,AF12/AJ12) -> 0.29577613637584838 | AJ12: 1249.490966796875 | AK12: 1246.8699951171875
A13: 41641 | B13: 0.000 | C13: 0.000 | D13: =IF((C13<1),0,B13/C13) -> 0.000 | E13: 0.000 | F13: 0.000 | G13: =IF((F13<1),0,E13/F13) -> 0.000 | H13: 91.919609069824219 | I13: 313.95001220703125 | J13: =IF((I13<1),0,H13/I13) -> 0.29278421881126965 | K13: 82.634849548339844 | L13: 297.65841674804687 | M13: =IF((L13<1),0,K13/L13) -> 0.27761637131291389 | N13: 0.000 | O13: 0.37336218357086182 | P13: =IF((O13<1),0,N13/O13) -> 0.000 | Q13: 91.760780334472656 | R13: 292.6285400390625 | S13: =IF((R13<1),0,Q13/R13) -> 0.31357426832742857 | T13: 0.000 | U13: 0.000 | V13: =IF((U13<1),0,T13/U13) -> 0.000 | W13: 0.000 | X13: 0.34549158811569214 | Y13: =IF((X13<1),0,W13/X13) -> 0.000 | Z13: 89.221702575683594 | AA13: 305.20660400390625 | AB13: =IF((AA13<1),0,Z13/AA13) -> 0.29233214945290525 | AC13: 0.000 | AD13: 0.26851743459701538 | AE13: =IF((AD13<1),0,AC13/AD13) -> 0.000 | AF13: =SUM(B13,E13,H13,K13,N13,Q13,T13,W13,Z13,AC13) -> 355.53694152832031 | AG13: =SUM(C13,F13,I13,L13,O13,R13,U13,X13,AA13,AD13) -> 1210.4309442043304 | AH13: =IF((AJ13=0),0,AF13/AG13) -> 0.29372757135024369 | AI13: =IF((AJ13=0),0,AF13/AJ13) -> 0.29401003086513222 | AJ13: 1209.26806640625 | AK13: 1201.949951171875
A14: 41642 | B14: 0.000 | C14: 0.000 | D14: =IF((C14<1),0,B14/C14) -> 0.000 | E14: 0.000 | F14: 0.000 | G14: =IF((F14<1),0,E14/F14) -> 0.000 | H14: 91.446495056152344 | I14: 309.77999877929687 | J14: =IF((I14<1),0,H14/I14) -> 0.29519819038188938 | K14: 82.399284362792969 | L14: 294.56668090820312 | M14: =IF((L14<1),0,K14/L14) -> 0.27973049806156236 | N14: 0.000 | O14: 0.37600848078727722 | P14: =IF((O14<1),0,N14/O14) -> 0.000 | Q14: 91.443717956542969 | R14: 288.90231323242187 | S14: =IF((R14<1),0,Q14/R14) -> 0.31652123838474255 | T14: 0.000 | U14: 0.000 | V14: =IF((U14<1),0,T14/U14) -> 0.000 | W14: 0.000 | X14: 0.23487363755702972 | Y14: =IF((X14<1),0,W14/X14) -> 0.000 | Z14: 88.206916809082031 | AA14: 299.06561279296875 | AB14: =IF((AA14<1),0,Z14/AA14) -> 0.29494168849878499 | AC14: 0.000 | AD14: 0.26900455355644226 | AE14: =IF((AD14<1),0,AC14/AD14) -> 0.000 | AF14: =SUM(B14,E14,H14,K14,N14,Q14,T14,W14,Z14,AC14) -> 353.49641418457031 | AG14: =SUM(C14,F14,I14,L14,O14,R14,U14,X14,AA14,AD14) -> 1193.1944923847914 | AH14: =IF((AJ14=0),0,AF14/AG14) -> 0.2962605144766054 | AI14: =IF((AJ14=0),0,AF14/AJ14) -> 0.30006803966999013 | AJ14: 1178.05419921875 | AK14: 1185.9200439453125
A15: 41643 | B15: 0.000 | C15: 0.000 | D15: =IF((C15<1),0,B15/C15) -> 0.000 | E15: 0.000 | F15: 0.000 | G15: =IF((F15<1),0,E15/F15) -> 0.000 | H15: 91.186897277832031 | I15: 311.08999633789062 | J15: =IF((I15<1),0,H15/I15) -> 0.29312063502932223 | K15: 84.319664001464844 | L15: 302.4278564453125 | M15: =IF((L15<1),0,K15/L15) -> 0.2788091844201932 | N15: 0.000 | O15: 0.38069945573806763 | P15: =IF((O15<1),0,N15/O15) -> 0.000 | Q15: 90.443733215332031 | R15: 286.74017333984375 | S15: =IF((R15<1),0,Q15/R15) -> 0.31542051524164472 | T15: 0.000 | U15: 0.000 | V15: =IF((U15<1),0,T15/U15) -> 0.000 | W15: 0.000 | X15: 0.28070425987243652 | Y15: =IF((X15<1),0,W15/X15) -> 0.000 | Z15: 87.252822875976562 | AA15: 297.40093994140625 | AB15: =IF((AA15<1),0,Z15/AA15) -> 0.29338448927958016 | AC15: 0.000 | AD15: 0.26901066303253174 | AE15: =IF((AD15<1),0,AC15/AD15) -> 0.000 | AF15: =SUM(B15,E15,H15,K15,N15,Q15,T15,W15,Z15,AC15) -> 353.20311737060547 | AG15: =SUM(C15,F15,I15,L15,O15,R15,U15,X15,AA15,AD15) -> 1198.5893804430962 | AH15: =IF((AJ15=0),0,AF15/AG15) -> 0.29468233502956021 | AI15: =IF((AJ15=0),0,AF15/AJ15) -> 0.29790430370746435 | AJ15: 1185.6260986328125 | AK15: 1194.0899658203125
A16: 41644 | B16: 0.000 | C16: 0.000 | D16: =IF((C16<1),0,B16/C16) -> 0.000 | E16: 0.000 | F16: 0.000 | G16: =IF((F16<1),0,E16/F16) -> 0.000 | H16: 0.000 | I16: 0.000 | J16: =IF((I16<1),0,H16/I16) -> 0.000 | K16: 85.753639221191406 | L16: 302.91134643554687 | M16: =IF((L16<1),0,K16/L16) -> 0.28309814151989177 | N16: 0.000 | O16: 0.3846321702003479 | P16: =IF((O16<1),0,N16/O16) -> 0.000 | Q16: 92.183670043945313 | R16: 288.5382080078125 | S16: =IF((R16<1),0,Q16/R16) -> 0.31948514091225427 | T16: 0.000 | U16: 0.000 | V16: =IF((U16<1),0,T16/U16) -> 0.000 | W16: 0.000 | X16: 0.13533636927604675 | Y16: =IF((X16<1),0,W16/X16) -> 0.000 | Z16: 86.546112060546875 | AA16: 291.39010620117187 | AB16: =IF((AA16<1),0,Z16/AA16) -> 0.29701115521333654 | AC16: 0.000 | AD16: 0.26972568035125732 | AE16: =IF((AD16<1),0,AC16/AD16) -> 0.000 | AF16: =SUM(B16,E16,H16,K16,N16,Q16,T16,W16,Z16,AC16) -> 264.48342132568359 | AG16: =SUM(C16,F16,I16,L16,O16,R16,U16,X16,AA16,AD16) -> 883.6293548643589 | AH16: =IF((AJ16=0),0,AF16/AG16) -> 0.29931488793316852 | AI16: =IF((AJ16=0),0,AF16/AJ16) -> 0.22325446450053721 | AJ16: 1184.6724853515625 | AK16: 0.00
A17: 41645 | B17: 0.000 | C17: 0.000 | D17: =IF((C17<1),0,B17/C17) -> 0.000 | E17: 0.000 | F17: 0.000 | G17: =IF((F17<1),0,E17/F17) -> 0.000 | H17: 0.000 | I17: 0.000 | J17: =IF((I17<1),0,H17/I17) -> 0.000 | K17: 0.000 | L17: 0.000 | M17: =IF((L17<1),0,K17/L17) -> 0.000 | N17: 0.000 | O17: 0.000 | P17: =IF((O17<1),0,N17/O17) -> 0.000 | Q17: 0.000 | R17: 0.000 | S17: =IF((R17<1),0,Q17/R17) -> 0.000 | T17: 0.000 | U17: 0.000 | V17: =IF((U17<1),0,T17/U17) -> 0.000 | W17: 0.000 | X17: 0.000 | Y17: =IF((X17<1),0,W17/X17) -> 0.000 | Z17: 0.000 | AA17: 0.000 | AB17: =IF((AA17<1),0,Z17/AA17) -> 0.000 | AC17: 0.000 | AD17: 0.000 | AE17: =IF((AD17<1),0,AC17/AD17) -> 0.000 | AF17: =SUM(B17,E17,H17,K17,N17,Q17,T17,W17,Z17,AC17) -> 0.000 | AG17: =SUM(C17,F17,I17,L17,O17,R17,U17,X17,AA17,AD17) -> 0.000 | AH17: =IF((AJ17=0),0,AF17/AG17) -> 0.000 | AI17: =IF((AJ17=0),0,AF17/AJ17) -> 0.000 | AJ17: 0.00 | AK17: 0.00
A18: 0 | B18: 0.000 | C18: 0.000 | D18: =IF((C18<1),0,B18/C18) -> 0.000 | E18: 0.000 | F18: 0.000 | G18: =IF((F18<1),0,E18/F18) -> 0.000 | H18: 0.000 | I18: 0.000 | J18: =IF((I18<1),0,H18/I18) -> 0.000 | K18: 0.000 | L18: 0.000 | M18: =IF((L18<1),0,K18/L18) -> 0.000 | N18: 0.000 | O18: 0.000 | P18: =IF((O18<1),0,N18/O18) -> 0.000 | Q18: 0.000 | R18: 0.000 | S18: =IF((R18<1),0,Q18/R18) -> 0.000 | T18: 0.000 | U18: 0.000 | V18: =IF((U18<1),0,T18/U18) -> 0.000 | W18: 0.000 | X18: 0.000 | Y18: =IF((X18<1),0,W18/X18) -> 0.000 | Z18: 0.000 | AA18: 0.000 | AB18: =IF((AA18<1),0,Z18/AA18) -> 0.000 | AC18: 0.000 | AD18: 0.000 | AE18: =IF((AD18<1),0,AC18/AD18) -> 0.000 | AF18: =SUM(B18,E18,H18,K18,N18,Q18,T18,W18,Z18,AC18) -> 0.000 | AG18: =SUM(C18,F18,I18,L18,O18,R18,U18,X18,AA18,AD18) -> 0.000 | AH18: =IF((AJ18=0),0,AF18/AG18) -> 0.000 | AI18: =IF((AJ18=0),0,AF18/AJ18) -> 0.000 | AJ18: 0.00 | AK18: 0.00
A19: 0 | B19: 0.000 | C19: 0.000 | D19: =IF((C19<1),0,B19/C19) -> 0.000 | E19: 0.000 | F19: 0.000 | G19: =IF((F19<1),0,E19/F19) -> 0.000 | H19: 0.000 | I19: 0.000 | J19: =IF((I19<1),0,H19/I19) -> 0.000 | K19: 0.000 | L19: 0.000 | M19: =IF((L19<1),0,K19/L19) -> 0.000 | N19: 0.000 | O19: 0.000 | P19: =IF((O19<1),0,N19/O19) -> 0.000 | Q19: 0.000 | R19: 0.000 | S19: =IF((R19<1),0,Q19/R19) -> 0.000 | T19: 0.000 | U19: 0.000 | V19: =IF((U19<1),0,T19/U19) -> 0.000 | W19: 0.000 | X19: 0.000 | Y19: =IF((X19<1),0,W19/X19) -> 0.000 | Z19: 0.000 | AA19: 0.000 | AB19: =IF((AA19<1),0,Z19/AA19) -> 0.000 | AC19: 0.000 | AD19: 0.000 | AE19: =IF((AD19<1),0,AC19/AD19) -> 0.000 | AF19: =SUM(B19,E19,H19,K19,N19,Q19,T19,W19,Z19,AC19) -> 0.000 | AG19: =SUM(C19,F19,I19,L19,O19,R19,U19,X19,AA19,AD19) -> 0.000 | AH19: =IF((AJ19=0),0,AF19/AG19) -> 0.000 | AI19: =IF((AJ19=0),0,AF19/AJ19) -> 0.000 | AJ19: 0.00 | AK19: 0.00
A20: 0 | B20: 0.000 | C20: 0.000 | D20: =IF((C20<1),0,B20/C20) -> 0.000 | E20: 0.000 | F20: 0.000 | G20: =IF((F20<1),0,E20/F20) -> 0.000 | H20: 0.000 | I20: 0.000 | J20: =IF((I20<1),0,H20/I20) -> 0.000 | K20: 0.000 | L20: 0.000 | M20: =IF((L20<1),0,K20/L20) -> 0.000 | N20: 0.000 | O20: 0.000 | P20: =IF((O20<1),0,N20/O20) -> 0.000 | Q20: 0.000 | R20: 0.000 | S20: =IF((R20<1),0,Q20/R20) -> 0.000 | T20: 0.000 | U20: 0.000 | V20: =IF((U20<1),0,T20/U20) -> 0.000 | W20: 0.000 | X20: 0.000 | Y20: =IF((X20<1),0,W20/X20) -> 0.000 | Z20: 0.000 | AA20: 0.000 | AB20: =IF((AA20<1),0,Z20/AA20) -> 0.000 | AC20: 0.000 | AD20: 0.000 | AE20: =IF((AD20<1),0,AC20/AD20) -> 0.000 | AF20: =SUM(B20,E20,H20,K20,N20,Q20,T20,W20,Z20,AC20) -> 0.000 | AG20: =SUM(C20,F20,I20,L20,O20,R20,U20,X20,AA20,AD20) -> 0.000 | AH20: =IF((AJ20=0),0,AF20/AG20) -> 0.000 | AI20: =IF((AJ20=0),0,AF20/AJ20) -> 0.000 | AJ20: 0.00 | AK20: 0.00
A21: 0 | B21: 0.000 | C21: 0.000 | D21: =IF((C21<1),0,B21/C21) -> 0.000 | E21: 0.000 | F21: 0.000 | G21: =IF((F21<1),0,E21/F21) -> 0.000 | H21: 0.000 | I21: 0.000 | J21: =IF((I21<1),0,H21/I21) -> 0.000 | K21: 0.000 | L21: 0.000 | M21: =IF((L21<1),0,K21/L21) -> 0.000 | N21: 0.000 | O21: 0.000 | P21: =IF((O21<1),0,N21/O21) -> 0.000 | Q21: 0.000 | R21: 0.000 | S21: =IF((R21<1),0,Q21/R21) -> 0.000 | T21: 0.000 | U21: 0.000 | V21: =IF((U21<1),0,T21/U21) -> 0.000 | W21: 0.000 | X21: 0.000 | Y21: =IF((X21<1),0,W21/X21) -> 0.000 | Z21: 0.000 | AA21: 0.000 | AB21: =IF((AA21<1),0,Z21/AA21) -> 0.000 | AC21: 0.000 | AD21: 0.000 | AE21: =IF((AD21<1),0,AC21/AD21) -> 0.000 | AF21: =SUM(B21,E21,H21,K21,N21,Q21,T21,W21,Z21,AC21) -> 0.000 | AG21: =SUM(C21,F21,I21,L21,O21,R21,U21,X21,AA21,AD21) -> 0.000 | AH21: =IF((AJ21=0),0,AF21/AG21) -> 0.000 | AI21: =IF((AJ21=0),0,AF21/AJ21) -> 0.000 | AJ21: 0.00 | AK21: 0.00
A22: 0 | B22: 0.000 | C22: 0.000 | D22: =IF((C22<1),0,B22/C22) -> 0.000 | E22: 0.000 | F22: 0.000 | G22: =IF((F22<1),0,E22/F22) -> 0.000 | H22: 0.000 | I22: 0.000 | J22: =IF((I22<1),0,H22/I22) -> 0.000 | K22: 0.000 | L22: 0.000 | M22: =IF((L22<1),0,K22/L22) -> 0.000 | N22: 0.000 | O22: 0.000 | P22: =IF((O22<1),0,N22/O22) -> 0.000 | Q22: 0.000 | R22: 0.000 | S22: =IF((R22<1),0,Q22/R22) -> 0.000 | T22: 0.000 | U22: 0.000 | V22: =IF((U22<1),0,T22/U22) -> 0.000 | W22: 0.000 | X22: 0.000 | Y22: =IF((X22<1),0,W22/X22) -> 0.000 | Z22: 0.000 | AA22: 0.000 | AB22: =IF((AA22<1),0,Z22/AA22) -> 0.000 | AC22: 0.000 | AD22: 0.000 | AE22: =IF((AD22<1),0,AC22/AD22) -> 0.000 | AF22: =SUM(B22,E22,H22,K22,N22,Q22,T22,W22,Z22,AC22) -> 0.000 | AG22: =SUM(C22,F22,I22,L22,O22,R22,U22,X22,AA22,AD22) -> 0.000 | AH22: =IF((AJ22=0),0,AF22/AG22) -> 0.000 | AI22: =IF((AJ22=0),0,AF22/AJ22) -> 0.000 | AJ22: 0.00 | AK22: 0.00
A23: 0 | B23: 0.000 | C23: 0.000 | D23: =IF((C23<1),0,B23/C23) -> 0.000 | E23: 0.000 | F23: 0.000 | G23: =IF((F23<1),0,E23/F23) -> 0.000 | H23: 0.000 | I23: 0.000 | J23: =IF((I23<1),0,H23/I23) -> 0.000 | K23: 0.000 | L23: 0.000 | M23: =IF((L23<1),0,K23/L23) -> 0.000 | N23: 0.000 | O23: 0.000 | P23: =IF((O23<1),0,N23/O23) -> 0.000 | Q23: 0.000 | R23: 0.000 | S23: =IF((R23<1),0,Q23/R23) -> 0.000 | T23: 0.000 | U23: 0.000 | V23: =IF((U23<1),0,T23/U23) -> 0.000 | W23: 0.000 | X23: 0.000 | Y23: =IF((X23<1),0,W23/X23) -> 0.000 | Z23: 0.000 | AA23: 0.000 | AB23: =IF((AA23<1),0,Z23/AA23) -> 0.000 | AC23: 0.000 | AD23: 0.000 | AE23: =IF((AD23<1),0,AC23/AD23) -> 0.000 | AF23: =SUM(B23,E23,H23,K23,N23,Q23,T23,W23,Z23,AC23) -> 0.000 | AG23: =SUM(C23,F23,I23,L23,O23,R23,U23,X23,AA23,AD23) -> 0.000 | AH23: =IF((AJ23=0),0,AF23/AG23) -> 0.000 | AI23: =IF((AJ23=0),0,AF23/AJ23) -> 0.000 | AJ23: 0.00 | AK23: 0.00
A24: 0 | B24: 0.000 | C24: 0.000 | D24: =IF((C24<1),0,B24/C24) -> 0.000 | E24: 0.000 | F24: 0.000 | G24: =IF((F24<1),0,E24/F24) -> 0.000 | H24: 0.000 | I24: 0.000 | J24: =IF((I24<1),0,H24/I24) -> 0.000 | K24: 0.000 | L24: 0.000 | M24: =IF((L24<1),0,K24/L24) -> 0.000 | N24: 0.000 | O24: 0.000 | P24: =IF((O24<1),0,N24/O24) -> 0.000 | Q24: 0.000 | R24: 0.000 | S24: =IF((R24<1),0,Q24/R24) -> 0.000 | T24: 0.000 | U24: 0.000 | V24: =IF((U24<1),0,T24/U24) -> 0.000 | W24: 0.000 | X24: 0.000 | Y24: =IF((X24<1),0,W24/X24) -> 0.000 | Z24: 0.000 | AA24: 0.000 | AB24: =IF((AA24<1),0,Z24/AA24) -> 0.000 | AC24: 0.000 | AD24: 0.000 | AE24: =IF((AD24<1),0,AC24/AD24) -> 0.000 | AF24: =SUM(B24,E24,H24,K24,N24,Q24,T24,W24,Z24,AC24) -> 0.000 | AG24: =SUM(C24,F24,I24,L24,O24,R24,U24,X24,AA24,AD24) -> 0.000 | AH24: =IF((AJ24=0),0,AF24/AG24) -> 0.000 | AI24: =IF((AJ24=0),0,AF24/AJ24) -> 0.000 | AJ24: 0.00 | AK24: 0.00
A25: 0 | B25: 0.000 | C25: 0.000 | D25: =IF((C25<1),0,B25/C25) -> 0.000 | E25: 0.000 | F25: 0.000 | G25: =IF((F25<1),0,E25/F25) -> 0.000 | H25: 0.000 | I25: 0.000 | J25: =IF((I25<1),0,H25/I25) -> 0.000 | K25: 0.000 | L25: 0.000 | M25: =IF((L25<1),0,K25/L25) -> 0.000 | N25: 0.000 | O25: 0.000 | P25: =IF((O25<1),0,N25/O25) -> 0.000 | Q25: 0.000 | R25: 0.000 | S25: =IF((R25<1),0,Q25/R25) -> 0.000 | T25: 0.000 | U25: 0.000 | V25: =IF((U25<1),0,T25/U25) -> 0.000 | W25: 0.000 | X25: 0.000 | Y25: =IF((X25<1),0,W25/X25) -> 0.000 | Z25: 0.000 | AA25: 0.000 | AB25: =IF((AA25<1),0,Z25/AA25) -> 0.000 | AC25: 0.000 | AD25: 0.000 | AE25: =IF((AD25<1),0,AC25/AD25) -> 0.000 | AF25: =SUM(B25,E25,H25,K25,N25,Q25,T25,W25,Z25,AC25) -> 0.000 | AG25: =SUM(C25,F25,I25,L25,O25,R25,U25,X25,AA25,AD25) -> 0.000 | AH25: =IF((AJ25=0),0,AF25/AG25) -> 0.000 | AI25: =IF((AJ25=0),0,AF25/AJ25) -> 0.000 | AJ25: 0.00 | AK25: 0.00
A26: 0 | B26: 0.000 | C26: 0.000 | D26: =IF((C26<1),0,B26/C26) -> 0.000 | E26: 0.000 | F26: 0.000 | G26: =IF((F26<1),0,E26/F26) -> 0.000 | H26: 0.000 | I26: 0.000 | J26: =IF((I26<1),0,H26/I26) -> 0.000 | K26: 0.000 | L26: 0.000 | M26: =IF((L26<1),0,K26/L26) -> 0.000 | N26: 0.000 | O26: 0.000 | P26: =IF((O26<1),0,N26/O26) -> 0.000 | Q26: 0.000 | R26: 0.000 | S26: =IF((R26<1),0,Q26/R26) -> 0.000 | T26: 0.000 | U26: 0.000 | V26: =IF((U26<1),0,T26/U26) -> 0.000 | W26: 0.000 | X26: 0.000 | Y26: =IF((X26<1),0,W26/X26) -> 0.000 | Z26: 0.000 | AA26: 0.000 | AB26: =IF((AA26<1),0,Z26/AA26) -> 0.000 | AC26: 0.000 | AD26: 0.000 | AE26: =IF((AD26<1),0,AC26/AD26) -> 0.000 | AF26: =SUM(B26,E26,H26,K26,N26,Q26,T26,W26,Z26,AC26) -> 0.000 | AG26: =SUM(C26,F26,I26,L26,O26,R26,U26,X26,AA26,AD26) -> 0.000 | AH26: =IF((AJ26=0),0,AF26/AG26) -> 0.000 | AI26: =IF((AJ26=0),0,AF26/AJ26) -> 0.000 | AJ26: 0.00 | AK26: 0.00
A27: 0 | B27: 0.000 | C27: 0.000 | D27: =IF((C27<1),0,B27/C27) -> 0.000 | E27: 0.000 | F27: 0.000 | G27: =IF((F27<1),0,E27/F27) -> 0.000 | H27: 0.000 | I27: 0.000 | J27: =IF((I27<1),0,H27/I27) -> 0.000 | K27: 0.000 | L27: 0.000 | M27: =IF((L27<1),0,K27/L27) -> 0.000 | N27: 0.000 | O27: 0.000 | P27: =IF((O27<1),0,N27/O27) -> 0.000 | Q27: 0.000 | R27: 0.000 | S27: =IF((R27<1),0,Q27/R27) -> 0.000 | T27: 0.000 | U27: 0.000 | V27: =IF((U27<1),0,T27/U27) -> 0.000 | W27: 0.000 | X27: 0.000 | Y27: =IF((X27<1),0,W27/X27) -> 0.000 | Z27: 0.000 | AA27: 0.000 | AB27: =IF((AA27<1),0,Z27/AA27) -> 0.000 | AC27: 0.000 | AD27: 0.000 | AE27: =IF((AD27<1),0,AC27/AD27) -> 0.000 | AF27: =SUM(B27,E27,H27,K27,N27,Q27,T27,W27,Z27,AC27) -> 0.000 | AG27: =SUM(C27,F27,I27,L27,O27,R27,U27,X27,AA27,AD27) -> 0.000 | AH27: =IF((AJ27=0),0,AF27/AG27) -> 0.000 | AI27: =IF((AJ27=0),0,AF27/AJ27) -> 0.000 | AJ27: 0.00 | AK27: 0.00
A28: 0 | B28: 0.000 | C28: 0.000 | D28: =IF((C28<1),0,B28/C28) -> 0.000 | E28: 0.000 | F28: 0.000 | G28: =IF((F28<1),0,E28/F28) -> 0.000 | H28: 0.000 | I28: 0.000 | J28: =IF((I28<1),0,H28/I28) -> 0.000 | K28: 0.000 | L28: 0.000 | M28: =IF((L28<1),0,K28/L28) -> 0.000 | N28: 0.000 | O28: 0.000 | P28: =IF((O28<1),0,N28/O28) -> 0.000 | Q28: 0.000 | R28: 0.000 | S28: =IF((R28<1),0,Q28/R28) -> 0.000 | T28: 0.000 | U28: 0.000 | V28: =IF((U28<1),0,T28/U28) -> 0.000 | W28: 0.000 | X28: 0.000 | Y28: =IF((X28<1),0,W28/X28) -> 0.000 | Z28: 0.000 | AA28: 0.000 | AB28: =IF((AA28<1),0,Z28/AA28) -> 0.000 | AC28: 0.000 | AD28: 0.000 | AE28: =IF((AD28<1),0,AC28/AD28) -> 0.000 | AF28: =SUM(B28,E28,H28,K28,N28,Q28,T28,W28,Z28,AC28) -> 0.000 | AG28: =SUM(C28,F28,I28,L28,O28,R28,U28,X28,AA28,AD28) -> 0.000 | AH28: =IF((AJ28=0),0,AF28/AG28) -> 0.000 | AI28: =IF((AJ28=0),0,AF28/AJ28) -> 0.000 | AJ28: 0.00 | AK28: 0.00
A29: 0 | B29: 0.000 | C29: 0.000 | D29: =IF((C29<1),0,B29/C29) -> 0.000 | E29: 0.000 | F29: 0.000 | G29: =IF((F29<1),0,E29/F29) -> 0.000 | H29: 0.000 | I29: 0.000 | J29: =IF((I29<1),0,H29/I29) -> 0.000 | K29: 0.000 | L29: 0.000 | M29: =IF((L29<1),0,K29/L29) -> 0.000 | N29: 0.000 | O29: 0.000 | P29: =IF((O29<1),0,N29/O29) -> 0.000 | Q29: 0.000 | R29: 0.000 | S29: =IF((R29<1),0,Q29/R29) -> 0.000 | T29: 0.000 | U29: 0.000 | V29: =IF((U29<1),0,T29/U29) -> 0.000 | W29: 0.000 | X29: 0.000 | Y29: =IF((X29<1),0,W29/X29) -> 0.000 | Z29: 0.000 | AA29: 0.000 | AB29: =IF((AA29<1),0,Z29/AA29) -> 0.000 | AC29: 0.000 | AD29: 0.000 | AE29: =IF((AD29<1),0,AC29/AD29) -> 0.000 | AF29: =SUM(B29,E29,H29,K29,N29,Q29,T29,W29,Z29,AC29) -> 0.000 | AG29: =SUM(C29,F29,I29,L29,O29,R29,U29,X29,AA29,AD29) -> 0.000 | AH29: =IF((AJ29=0),0,AF29/AG29) -> 0.000 | AI29: =IF((AJ29=0),0,AF29/AJ29) -> 0.000 | AJ29: 0.00 | AK29: 0.00
A30: 0 | B30: 0.000 | C30: 0.000 | D30: =IF((C30<1),0,B30/C30) -> 0.000 | E30: 0.000 | F30: 0.000 | G30: =IF((F30<1),0,E30/F30) -> 0.000 | H30: 0.000 | I30: 0.000 | J30: =IF((I30<1),0,H30/I30) -> 0.000 | K30: 0.000 | L30: 0.000 | M30: =IF((L30<1),0,K30/L30) -> 0.000 | N30: 0.000 | O30: 0.000 | P30: =IF((O30<1),0,N30/O30) -> 0.000 | Q30: 0.000 | R30: 0.000 | S30: =IF((R30<1),0,Q30/R30) -> 0.000 | T30: 0.000 | U30: 0.000 | V30: =IF((U30<1),0,T30/U30) -> 0.000 | W30: 0.000 | X30: 0.000 | Y30: =IF((X30<1),0,W30/X30) -> 0.000 | Z30: 0.000 | AA30: 0.000 | AB30: =IF((AA30<1),0,Z30/AA30) -> 0.000 | AC30: 0.000 | AD30: 0.000 | AE30: =IF((AD30<1),0,AC30/AD30) -> 0.000 | AF30: =SUM(B30,E30,H30,K30,N30,Q30,T30,W30,Z30,AC30) -> 0.000 | AG30: =SUM(C30,F30,I30,L30,O30,R30,U30,X30,AA30,AD30) -> 0.000 | AH30: =IF((AJ30=0),0,AF30/AG30) -> 0.000 | AI30: =IF((AJ30=0),0,AF30/AJ30) -> 0.000 | AJ30: 0.00 | AK30: 0.00
A31: 0 | B31: 0.000 | C31: 0.000 | D31: =IF((C31<1),0,B31/C31) -> 0.000 | E31: 0.000 | F31: 0.000 | G31: =IF((F31<1),0,E31/F31) -> 0.000 | H31: 0.000 | I31: 0.000 | J31: =IF((I31<1),0,H31/I31) -> 0.000 | K31: 0.000 | L31: 0.000 | M31: =IF((L31<1),0,K31/L31) -> 0.000 | N31: 0.000 | O31: 0.000 | P31: =IF((O31<1),0,N31/O31) -> 0.000 | Q31: 0.000 | R31: 0.000 | S31: =IF((R31<1),0,Q31/R31) -> 0.000 | T31: 0.000 | U31: 0.000 | V31: =IF((U31<1),0,T31/U31) -> 0.000 | W31: 0.000 | X31: 0.000 | Y31: =IF((X31<1),0,W31/X31) -> 0.000 | Z31: 0.000 | AA31: 0.000 | AB31: =IF((AA31<1),0,Z31/AA31) -> 0.000 | AC31: 0.000 | AD31: 0.000 | AE31: =IF((AD31<1),0,AC31/AD31) -> 0.000 | AF31: =SUM(B31,E31,H31,K31,N31,Q31,T31,W31,Z31,AC31) -> 0.000 | AG31: =SUM(C31,F31,I31,L31,O31,R31,U31,X31,AA31,AD31) -> 0.000 | AH31: =IF((AJ31=0),0,AF31/AG31) -> 0.000 | AI31: =IF((AJ31=0),0,AF31/AJ31) -> 0.000 | AJ31: 0.00 | AK31: 0.00
A32: 0 | B32: 0.000 | C32: 0.000 | D32: =IF((C32<1),0,B32/C32) -> 0.000 | E32: 0.000 | F32: 0.000 | G32: =IF((F32<1),0,E32/F32) -> 0.000 | H32: 0.000 | I32: 0.000 | J32: =IF((I32<1),0,H32/I32) -> 0.000 | K32: 0.000 | L32: 0.000 | M32: =IF((L32<1),0,K32/L32) -> 0.000 | N32: 0.000 | O32: 0.000 | P32: =IF((O32<1),0,N32/O32) -> 0.000 | Q32: 0.000 | R32: 0.000 | S32: =IF((R32<1),0,Q32/R32) -> 0.000 | T32: 0.000 | U32: 0.000 | V32: =IF((U32<1),0,T32/U32) -> 0.000 | W32: 0.000 | X32: 0.000 | Y32: =IF((X32<1),0,W32/X32) -> 0.000 | Z32: 0.000 | AA32: 0.000 | AB32: =IF((AA32<1),0,Z32/AA32) -> 0.000 | AC32: 0.000 | AD32: 0.000 | AE32: =IF((AD32<1),0,AC32/AD32) -> 0.000 | AF32: =SUM(B32,E32,H32,K32,N32,Q32,T32,W32,Z32,AC32) -> 0.000 | AG32: =SUM(C32,F32,I32,L32,O32,R32,U32,X32,AA32,AD32) -> 0.000 | AH32: =IF((AJ32=0),0,AF32/AG32) -> 0.000 | AI32: =IF((AJ32=0),0,AF32/AJ32) -> 0.000 | AJ32: 0.00 | AK32: 0.00
A33: 0 | B33: 0.000 | C33: 0.000 | D33: =IF((C33<1),0,B33/C33) -> 0.000 | E33: 0.000 | F33: 0.000 | G33: =IF((F33<1),0,E33/F33) -> 0.000 | H33: 0.000 | I33: 0.000 | J33: =IF((I33<1),0,H33/I33) -> 0.000 | K33: 0.000 | L33: 0.000 | M33: =IF((L33<1),0,K33/L33) -> 0.000 | N33: 0.000 | O33: 0.000 | P33: =IF((O33<1),0,N33/O33) -> 0.000 | Q33: 0.000 | R33: 0.000 | S33: =IF((R33<1),0,Q33/R33) -> 0.000 | T33: 0.000 | U33: 0.000 | V33: =IF((U33<1),0,T33/U33) -> 0.000 | W33: 0.000 | X33: 0.000 | Y33: =IF((X33<1),0,W33/X33) -> 0.000 | Z33: 0.000 | AA33: 0.000 | AB33: =IF((AA33<1),0,Z33/AA33) -> 0.000 | AC33: 0.000 | AD33: 0.000 | AE33: =IF((AD33<1),0,AC33/AD33) -> 0.000 | AF33: =SUM(B33,E33,H33,K33,N33,Q33,T33,W33,Z33,AC33) -> 0.000 | AG33: =SUM(C33,F33,I33,L33,O33,R33,U33,X33,AA33,AD33) -> 0.000 | AH33: =IF((AJ33=0),0,AF33/AG33) -> 0.000 | AI33: =IF((AJ33=0),0,AF33/AJ33) -> 0.000 | AJ33: 0.00 | AK33: 0.00
A34: 0 | B34: 0.000 | C34: 0.000 | D34: =IF((C34<1),0,B34/C34) -> 0.000 | E34: 0.000 | F34: 0.000 | G34: =IF((F34<1),0,E34/F34) -> 0.000 | H34: 0.000 | I34: 0.000 | J34: =IF((I34<1),0,H34/I34) -> 0.000 | K34: 0.000 | L34: 0.000 | M34: =IF((L34<1),0,K34/L34) -> 0.000 | N34: 0.000 | O34: 0.000 | P34: =IF((O34<1),0,N34/O34) -> 0.000 | Q34: 0.000 | R34: 0.000 | S34: =IF((R34<1),0,Q34/R34) -> 0.000 | T34: 0.000 | U34: 0.000 | V34: =IF((U34<1),0,T34/U34) -> 0.000 | W34: 0.000 | X34: 0.000 | Y34: =IF((X34<1),0,W34/X34) -> 0.000 | Z34: 0.000 | AA34: 0.000 | AB34: =IF((AA34<1),0,Z34/AA34) -> 0.000 | AC34: 0.000 | AD34: 0.000 | AE34: =IF((AD34<1),0,AC34/AD34) -> 0.000 | AF34: =SUM(B34,E34,H34,K34,N34,Q34,T34,W34,Z34,AC34) -> 0.000 | AG34: =SUM(C34,F34,I34,L34,O34,R34,U34,X34,AA34,AD34) -> 0.000 | AH34: =IF((AJ34=0),0,AF34/AG34) -> 0.000 | AI34: =IF((AJ34=0),0,AF34/AJ34) -> 0.000 | AJ34: 0.00 | AK34: 0.00
A35: 0 | B35: 0.000 | C35: 0.000 | D35: =IF((C35<1),0,B35/C35) -> 0.000 | E35: 0.000 | F35: 0.000 | G35: =IF((F35<1),0,E35/F35) -> 0.000 | H35: 0.000 | I35: 0.000 | J35: =IF((I35<1),0,H35/I35) -> 0.000 | K35: 0.000 | L35: 0.000 | M35: =IF((L35<1),0,K35/L35) -> 0.000 | N35: 0.000 | O35: 0.000 | P35: =IF((O35<1),0,N35/O35) -> 0.000 | Q35: 0.000 | R35: 0.000 | S35: =IF((R35<1),0,Q35/R35) -> 0.000 | T35: 0.000 | U35: 0.000 | V35: =IF((U35<1),0,T35/U35) -> 0.000 | W35: 0.000 | X35: 0.000 | Y35: =IF((X35<1),0,W35/X35) -> 0.000 | Z35: 0.000 | AA35: 0.000 | AB35: =IF((AA35<1),0,Z35/AA35) -> 0.000 | AC35: 0.000 | AD35: 0.000 | AE35: =IF((AD35<1),0,AC35/AD35) -> 0.000 | AF35: =SUM(B35,E35,H35,K35,N35,Q35,T35,W35,Z35,AC35) -> 0.000 | AG35: =SUM(C35,F35,I35,L35,O35,R35,U35,X35,AA35,AD35) -> 0.000 | AH35: =IF((AJ35=0),0,AF35/AG35) -> 0.000 | AI35: =IF((AJ35=0),0,AF35/AJ35) -> 0.000 | AJ35: 0.00 | AK35: 0.00
A36: 0 | B36: 0.000 | C36: 0.000 | D36: =IF((C36<1),0,B36/C36) -> 0.000 | E36: 0.000 | F36: 0.000 | G36: =IF((F36<1),0,E36/F36) -> 0.000 | H36: 0.000 | I36: 0.000 | J36: =IF((I36<1),0,H36/I36) -> 0.000 | K36: 0.000 | L36: 0.000 | M36: =IF((L36<1),0,K36/L36) -> 0.000 | N36: 0.000 | O36: 0.000 | P36: =IF((O36<1),0,N36/O36) -> 0.000 | Q36: 0.000 | R36: 0.000 | S36: =IF((R36<1),0,Q36/R36) -> 0.000 | T36: 0.000 | U36: 0.000 | V36: =IF((U36<1),0,T36/U36) -> 0.000 | W36: 0.000 | X36: 0.000 | Y36: =IF((X36<1),0,W36/X36) -> 0.000 | Z36: 0.000 | AA36: 0.000 | AB36: =IF((AA36<1),0,Z36/AA36) -> 0.000 | AC36: 0.000 | AD36: 0.000 | AE36: =IF((AD36<1),0,AC36/AD36) -> 0.000 | AF36: =SUM(B36,E36,H36,K36,N36,Q36,T36,W36,Z36,AC36) -> 0.000 | AG36: =SUM(C36,F36,I36,L36,O36,R36,U36,X36,AA36,AD36) -> 0.000 | AH36: =IF((AJ36=0),0,AF36/AG36) -> 0.000 | AI36: =IF((AJ36=0),0,AF36/AJ36) -> 0.000 | AJ36: 0.00 | AK36: 0.00
A37: 0 | B37: 0.000 | C37: 0.000 | D37: =IF((C37<1),0,B37/C37) -> 0.000 | E37: 0.000 | F37: 0.000 | G37: =IF((F37<1),0,E37/F37) -> 0.000 | H37: 0.000 | I37: 0.000 | J37: =IF((I37<1),0,H37/I37) -> 0.000 | K37: 0.000 | L37: 0.000 | M37: =IF((L37<1),0,K37/L37) -> 0.000 | N37: 0.000 | O37: 0.000 | P37: =IF((O37<1),0,N37/O37) -> 0.000 | Q37: 0.000 | R37: 0.000 | S37: =IF((R37<1),0,Q37/R37) -> 0.000 | T37: 0.000 | U37: 0.000 | V37: =IF((U37<1),0,T37/U37) -> 0.000 | W37: 0.000 | X37: 0.000 | Y37: =IF((X37<1),0,W37/X37) -> 0.000 | Z37: 0.000 | AA37: 0.000 | AB37: =IF((AA37<1),0,Z37/AA37) -> 0.000 | AC37: 0.000 | AD37: 0.000 | AE37: =IF((AD37<1),0,AC37/AD37) -> 0.000 | AF37: =SUM(B37,E37,H37,K37,N37,Q37,T37,W37,Z37,AC37) -> 0.000 | AG37: =SUM(C37,F37,I37,L37,O37,R37,U37,X37,AA37,AD37) -> 0.000 | AH37: =IF((AJ37=0),0,AF37/AG37) -> 0.000 | AI37: =IF((AJ37=0),0,AF37/AJ37) -> 0.000 | AJ37: 0.00 | AK37: 0.00
A38: 0 | B38: 0.000 | C38: 0.000 | D38: =IF((C38<1),0,B38/C38) -> 0.000 | E38: 0.000 | F38: 0.000 | G38: =IF((F38<1),0,E38/F38) -> 0.000 | H38: 0.000 | I38: 0.000 | J38: =IF((I38<1),0,H38/I38) -> 0.000 | K38: 0.000 | L38: 0.000 | M38: =IF((L38<1),0,K38/L38) -> 0.000 | N38: 0.000 | O38: 0.000 | P38: =IF((O38<1),0,N38/O38) -> 0.000 | Q38: 0.000 | R38: 0.000 | S38: =IF((R38<1),0,Q38/R38) -> 0.000 | T38: 0.000 | U38: 0.000 | V38: =IF((U38<1),0,T38/U38) -> 0.000 | W38: 0.000 | X38: 0.000 | Y38: =IF((X38<1),0,W38/X38) -> 0.000 | Z38: 0.000 | AA38: 0.000 | AB38: =IF((AA38<1),0,Z38/AA38) -> 0.000 | AC38: 0.000 | AD38: 0.000 | AE38: =IF((AD38<1),0,AC38/AD38) -> 0.000 | AF38: =SUM(B38,E38,H38,K38,N38,Q38,T38,W38,Z38,AC38) -> 0.000 | AG38: =SUM(C38,F38,I38,L38,O38,R38,U38,X38,AA38,AD38) -> 0.000 | AH38: =IF((AJ38=0),0,AF38/AG38) -> 0.000 | AI38: =IF((AJ38=0),0,AF38/AJ38) -> 0.000 | AJ38: 0.00 | AK38: 0.00
A39: 0 | B39: 0.000 | C39: 0.000 | D39: =IF((C39<1),0,B39/C39) -> 0.000 | E39: 0.000 | F39: 0.000 | G39: =IF((F39<1),0,E39/F39) -> 0.000 | H39: 0.000 | I39: 0.000 | J39: =IF((I39<1),0,H39/I39) -> 0.000 | K39: 0.000 | L39: 0.000 | M39: =IF((L39<1),0,K39/L39) -> 0.000 | N39: 0.000 | O39: 0.000 | P39: =IF((O39<1),0,N39/O39) -> 0.000 | Q39: 0.000 | R39: 0.000 | S39: =IF((R39<1),0,Q39/R39) -> 0.000 | T39: 0.000 | U39: 0.000 | V39: =IF((U39<1),0,T39/U39) -> 0.000 | W39: 0.000 | X39: 0.000 | Y39: =IF((X39<1),0,W39/X39) -> 0.000 | Z39: 0.000 | AA39: 0.000 | AB39: =IF((AA39<1),0,Z39/AA39) -> 0.000 | AC39: 0.000 | AD39: 0.000 | AE39: =IF((AD39<1),0,AC39/AD39) -> 0.000 | AF39: =SUM(B39,E39,H39,K39,N39,Q39,T39,W39,Z39,AC39) -> 0.000 | AG39: =SUM(C39,F39,I39,L39,O39,R39,U39,X39,AA39,AD39) -> 0.000 | AH39: =IF((AJ39=0),0,AF39/AG39) -> 0.000 | AI39: =IF((AJ39=0),0,AF39/AJ39) -> 0.000 | AJ39: 0.00 | AK39: 0.00
A40: 0 | B40: 0.000 | C40: 0.000 | D40: =IF((C40<1),0,B40/C40) -> 0.000 | E40: 0.000 | F40: 0.000 | G40: =IF((F40<1),0,E40/F40) -> 0.000 | H40: 0.000 | I40: 0.000 | J40: =IF((I40<1),0,H40/I40) -> 0.000 | K40: 0.000 | L40: 0.000 | M40: =IF((L40<1),0,K40/L40) -> 0.000 | N40: 0.000 | O40: 0.000 | P40: =IF((O40<1),0,N40/O40) -> 0.000 | Q40: 0.000 | R40: 0.000 | S40: =IF((R40<1),0,Q40/R40) -> 0.000 | T40: 0.000 | U40: 0.000 | V40: =IF((U40<1),0,T40/U40) -> 0.000 | W40: 0.000 | X40: 0.000 | Y40: =IF((X40<1),0,W40/X40) -> 0.000 | Z40: 0.000 | AA40: 0.000 | AB40: =IF((AA40<1),0,Z40/AA40) -> 0.000 | AC40: 0.000 | AD40: 0.000 | AE40: =IF((AD40<1),0,AC40/AD40) -> 0.000 | AF40: =SUM(B40,E40,H40,K40,N40,Q40,T40,W40,Z40,AC40) -> 0.000 | AG40: =SUM(C40,F40,I40,L40,O40,R40,U40,X40,AA40,AD40) -> 0.000 | AH40: =IF((AJ40=0),0,AF40/AG40) -> 0.000 | AI40: =IF((AJ40=0),0,AF40/AJ40) -> 0.000 | AJ40: 0.00 | AK40: 0.00
A41: 0 | B41: 0.000 | C41: 0.000 | D41: =IF((C41<1),0,B41/C41) -> 0.000 | E41: 0.000 | F41: 0.000 | G41: =IF((F41<1),0,E41/F41) -> 0.000 | H41: 0.000 | I41: 0.000 | J41: =IF((I41<1),0,H41/I41) -> 0.000 | K41: 0.000 | L41: 0.000 | M41: =IF((L41<1),0,K41/L41) -> 0.000 | N41: 0.000 | O41: 0.000 | P41: =IF((O41<1),0,N41/O41) -> 0.000 | Q41: 0.000 | R41: 0.000 | S41: =IF((R41<1),0,Q41/R41) -> 0.000 | T41: 0.000 | U41: 0.000 | V41: =IF((U41<1),0,T41/U41) -> 0.000 | W41: 0.000 | X41: 0.000 | Y41: =IF((X41<1),0,W41/X41) -> 0.000 | Z41: 0.000 | AA41: 0.000 | AB41: =IF((AA41<1),0,Z41/AA41) -> 0.000 | AC41: 0.000 | AD41: 0.000 | AE41: =IF((AD41<1),0,AC41/AD41) -> 0.000 | AF41: =SUM(B41,E41,H41,K41,N41,Q41,T41,W41,Z41,AC41) -> 0.000 | AG41: =SUM(C41,F41,I41,L41,O41,R41,U41,X41,AA41,AD41) -> 0.000 | AH41: =IF((AJ41=0),0,AF41/AG41) -> 0.000 | AI41: =IF((AJ41=0),0,AF41/AJ41) -> 0.000 | AJ41: 0.00 | AK41: 0.00
A42: 0 | B42: 0.000 | C42: 0.000 | D42: =IF((C42<1),0,B42/C42) -> 0.000 | E42: 0.000 | F42: 0.000 | G42: =IF((F42<1),0,E42/F42) -> 0.000 | H42: 0.000 | I42: 0.000 | J42: =IF((I42<1),0,H42/I42) -> 0.000 | K42: 0.000 | L42: 0.000 | M42: =IF((L42<1),0,K42/L42) -> 0.000 | N42: 0.000 | O42: 0.000 | P42: =IF((O42<1),0,N42/O42) -> 0.000 | Q42: 0.000 | R42: 0.000 | S42: =IF((R42<1),0,Q42/R42) -> 0.000 | T42: 0.000 | U42: 0.000 | V42: =IF((U42<1),0,T42/U42) -> 0.000 | W42: 0.000 | X42: 0.000 | Y42: =IF((X42<1),0,W42/X42) -> 0.000 | Z42: 0.000 | AA42: 0.000 | AB42: =IF((AA42<1),0,Z42/AA42) -> 0.000 | AC42: 0.000 | AD42: 0.000 | AE42: =IF((AD42<1),0,AC42/AD42) -> 0.000 | AF42: =SUM(B42,E42,H42,K42,N42,Q42,T42,W42,Z42,AC42) -> 0.000 | AG42: =SUM(C42,F42,I42,L42,O42,R42,U42,X42,AA42,AD42) -> 0.000 | AH42: =IF((AJ42=0),0,AF42/AG42) -> 0.000 | AI42: =IF((AJ42=0),0,AF42/AJ42) -> 0.000 | AJ42: 0.00 | AK42: 0.00
A43: Всего: | B43: =SUM(B12:B42) -> 0.000 | C43: =SUM(C12:C42) -> 0.000 | D43: =IF((C43=0),0,B43/C43) -> 0.000 | E43: =SUM(E12:E42) -> 0.000 | F43: =SUM(F12:F42) -> 0.000 | G43: =IF((F43=0),0,E43/F43) -> 0.000 | H43: =SUM(H12:H42) -> 367.80399322509766 | I43: =SUM(I12:I42) -> 1251.9500122070312 | J43: =IF((I43=0),0,H43/I43) -> 0.29378488728691748 | K43: =SUM(K12:K42) -> 423.92777252197266 | L43: =SUM(L12:L42) -> 1514.9860534667969 | M43: =IF((L43=0),0,K43/L43) -> 0.27982288784235576 | N43: =SUM(N12:N42) -> 0.000 | O43: =SUM(O12:O42) -> 1.5147122902965546 | P43: =IF((O43=0),0,N43/O43) -> 0.000 | Q43: =SUM(Q12:Q42) -> 458.82908630371094 | R43: =SUM(R12:R42) -> 1450.9622802734375 | S43: =IF((R43=0),0,Q43/R43) -> 0.31622399323657363 | T43: =SUM(T12:T42) -> 0.000 | U43: =SUM(U12:U42) -> 0.000 | V43: =IF((U43=0),0,T43/U43) -> 0.000 | W43: =SUM(W12:W42) -> 0.000 | X43: =SUM(X12:X42) -> 1.4548548310995102 | Y43: =IF((X43=0),0,W43/X43) -> 0.000 | Z43: =SUM(Z12:Z42) -> 445.72865295410156 | AA43: =SUM(AA12:AA42) -> 1514.3113098144531 | AB43: =IF((AA43=0),0,Z43/AA43) -> 0.29434413522851927 | AC43: =SUM(AC12:AC42) -> 0.000 | AD43: =SUM(AD12:AD42) -> 1.3473312258720398 | AE43: =IF((AD43=0),0,AC43/AD43) -> 0.000 | AF43: =SUM(AF12:AF42) -> 1696.2895050048828 | AG43: =SUM(AG12:AG42) -> 5736.5265541089866 | AH43: =IF((AJ43=0),0,AF43/AG43) -> 0.29569975646497382 | AI43: =IF((AJ43=0),0,AF43/AJ43) -> 0.28238021146403208 | AJ43: =SUM(AJ12:AJ42) -> 6007.11181640625 | AK43: =SUM(AK12:AK42) -> 4828.8299560546875
A44: Максимум: | B44: =MAX(B12:B42) -> 0.000 | C44: =MAX(C12:C42) -> 0.000 | D44: =MAX(D12:D42) -> 0.000 | E44: =MAX(E12:E42) -> 0.000 | F44: =MAX(F12:F42) -> 0.000 | G44: =MAX(G12:G42) -> 0.000 | H44: =MAX(H12:H42) -> 93.250991821289063 | I44: =MAX(I12:I42) -> 317.1300048828125 | J44: =MAX(J12:J42) -> 0.29519819038188938 | K44: =MAX(K12:K42) -> 88.820335388183594 | L44: =MAX(L12:L42) -> 317.4217529296875 | M44: =MAX(M12:M42) -> 0.28309814151989177 | N44: =MAX(N12:N42) -> 0.000 | O44: =MAX(O12:O42) -> 0.3846321702003479 | P44: =MAX(P12:P42) -> 0.000 | Q44: =MAX(Q12:Q42) -> 92.997184753417969 | R44: =MAX(R12:R42) -> 294.15304565429687 | S44: =MAX(S12:S42) -> 0.31948514091225427 | T44: =MAX(T12:T42) -> 0.000 | U44: =MAX(U12:U42) -> 0.000 | V44: =MAX(V12:V42) -> 0.000 | W44: =MAX(W12:W42) -> 0.000 | X44: =MAX(X12:X42) -> 0.45844897627830505 | Y44: =MAX(Y12:Y42) -> 0.000 | Z44: =MAX(Z12:Z42) -> 94.5010986328125 | AA44: =MAX(AA12:AA42) -> 321.248046875 | AB44: =MAX(AB12:AB42) -> 0.29701115521333654 | AC44: =MAX(AC12:AC42) -> 0.000 | AD44: =MAX(AD12:AD42) -> 0.27107289433479309 | AE44: =MAX(AE12:AE42) -> 0.000 | AF44: =MAX(AF12:AF42) -> 369.56961059570312 | AG44: =MAX(AG12:AG42) -> 1250.6823822124099 | AH44: =MAX(AH12:AH42) -> 0.29931488793316852 | AI44: =MAX(AI12:AI42) -> 0.30006803966999013 | AJ44: =MAX(AJ12:AJ42) -> 1249.490966796875 | AK44: =MAX(AK12:AK42) -> 1246.8699951171875
A45: Среднее: | B45: 0.000 | C45: 0.000 | D45: 0.000 | E45: 0.000 | F45: 0.000 | G45: 0.000 | H45: 73.560798645019531 | I45: 250.39000244140624 | J45: 0.23502992387966465 | K45: 84.785554504394526 | L45: 302.99721069335936 | M45: 0.27981444872003508 | N45: 0.000 | O45: 0.30294245805931092 | P45: 0.000 | Q45: 91.765817260742182 | R45: 290.19245605468751 | S45: 0.31623070808745557 | T45: 0.000 | U45: 0.000 | V45: 0.000 | W45: 0.000 | X45: 0.29097096621990204 | Y45: 0.000 | Z45: 89.145730590820307 | AA45: 302.86226196289061 | AB45: 0.29436762298288111 | AC45: 0.000 | AD45: 0.26946624517440798 | AE45: 0.000 | AF45: 339.25790100097657 | AG45: 1147.3053108217973 | AH45: 0.29589593703621742 | AI45: 0.28220259502379447 | AJ45: 1201.42236328125 | AK45: 965.7659912109375
A46: Минимум: | B46: =MIN(B12:B42) -> 0.000 | C46: =MIN(C12:C42) -> 0.000 | D46: =MIN(D12:D42) -> 0.000 | E46: =MIN(E12:E42) -> 0.000 | F46: =MIN(F12:F42) -> 0.000 | G46: =MIN(G12:G42) -> 0.000 | H46: =MIN(H12:H42) -> 0.000 | I46: =MIN(I12:I42) -> 0.000 | J46: =MIN(J12:J42) -> 0.000 | K46: =MIN(K12:K42) -> 0.000 | L46: =MIN(L12:L42) -> 0.000 | M46: =MIN(M12:M42) -> 0.000 | N46: =MIN(N12:N42) -> 0.000 | O46: =MIN(O12:O42) -> 0.000 | P46: =MIN(P12:P42) -> 0.000 | Q46: =MIN(Q12:Q42) -> 0.000 | R46: =MIN(R12:R42) -> 0.000 | S46: =MIN(S12:S42) -> 0.000 | T46: =MIN(T12:T42) -> 0.000 | U46: =MIN(U12:U42) -> 0.000 | V46: =MIN(V12:V42) -> 0.000 | W46: =MIN(W12:W42) -> 0.000 | X46: =MIN(X12:X42) -> 0.000 | Y46: =MIN(Y12:Y42) -> 0.000 | Z46: =MIN(Z12:Z42) -> 0.000 | AA46: =MIN(AA12:AA42) -> 0.000 | AB46: =MIN(AB12:AB42) -> 0.000 | AC46: =MIN(AC12:AC42) -> 0.000 | AD46: =MIN(AD12:AD42) -> 0.000 | AE46: =MIN(AE12:AE42) -> 0.000 | AF46: =MIN(AF12:AF42) -> 0.000 | AG46: =MIN(AG12:AG42) -> 0.000 | AH46: =MIN(AH12:AH42) -> 0.000 | AI46: =MIN(AI12:AI42) -> 0.000 | AJ46: =MIN(AJ12:AJ42) -> 0.00 | AK46: =MIN(AK12:AK42) -> 0.00
A51: Ст.мастер смены: | G51: ___________ | J51: /___________________/
A55: =NOW() -> 41645.005186921298