A1: data period - from: 2014-01-01 00:00:00 to: 2014-01-06 00:07:00
A3: ЦЕХ М-5
A5: МЕСЯЧНЫЙ БАЛАНС ПОТРЕБЛЕНИЯ NH3 (т/сут)
B7: отделение 1 | E7: отделение 2 | N7: по потребителям | O7: по АСМ
A8: Время | B8: AGR 1/1 | C8: Агр 2/1 | D8: Агр 3/1 | E8: Агр 1/2 | F8: Агр 2/2 | G8: Агр 3/2 | H8: Агр 4/2 | I8: Агр 5/2 | J8: Агр 6/2 | K8: Агр 7/2 | L8: Сумма | M8: Расх. коэф. План (0.298) | N8: HNO3 | O8: HNO3
A9: день | B9: т/сут | C9: т/сут | D9: т/сут | E9: т/сут | F9: т/сут | G9: т/сут | H9: т/сут | I9: т/сут | J9: т/сут | K9: т/сут | L9: т/сут | M9: 1 т.мнг | N9: т.мнг/сут | O9: т.мнг/сут
A11: 41640 | B11: 0.000 | C11: 0.000 | D11: 93.250991821289063 | E11: 88.820335388183594 | F11: 0.000 | G11: 92.997184753417969 | H11: 0.000 | I11: 0.000 | J11: 94.5010986328125 | K11: 0.000 | L11: =SUM(B11:K11) -> 369.56961059570312 | M11: =IF((N11=0),0,L11/N11) -> 0.29577613637584838 | N11: 1249.490966796875 | O11: 1246.8699951171875
A12: 41641 | B12: 0.000 | C12: 0.000 | D12: 91.919609069824219 | E12: 82.634849548339844 | F12: 0.000 | G12: 91.760780334472656 | H12: 0.000 | I12: 0.000 | J12: 89.221702575683594 | K12: 0.000 | L12: =SUM(B12:K12) -> 355.53694152832031 | M12: =IF((N12=0),0,L12/N12) -> 0.29401003086513222 | N12: 1209.26806640625 | O12: 1201.949951171875
A13: 41642 | B13: 0.000 | C13: 0.000 | D13: 91.446495056152344 | E13: 82.399284362792969 | F13: 0.000 | G13: 91.443717956542969 | H13: 0.000 | I13: 0.000 | J13: 88.206916809082031 | K13: 0.000 | L13: =SUM(B13:K13) -> 353.49641418457031 | M13: =IF((N13=0),0,L13/N13) -> 0.30006803966999013 | N13: 1178.05419921875 | O13: 1185.9200439453125
A14: 41643 | B14: 0.000 | C14: 0.000 | D14: 91.186897277832031 | E14: 84.319664001464844 | F14: 0.000 | G14: 90.443733215332031 | H14: 0.000 | I14: 0.000 | J14: 87.252822875976562 | K14: 0.000 | L14: =SUM(B14:K14) -> 353.20311737060547 | M14: =IF((N14=0),0,L14/N14) -> 0.29790430370746435 | N14: 1185.6260986328125 | O14: 1194.0899658203125
A15: 41644 | B15: 0.000 | C15: 0.000 | D15: 0.000 | E15: 0.000 | F15: 0.000 | G15: 0.000 | H15: 0.000 | I15: 0.000 | J15: 0.000 | K15: 0.000 | L15: =SUM(B15:K15) -> 0.000 | M15: =IF((N15=0),0,L15/N15) -> 0.000 | N15: 0.00 | O15: 0.00
A16: 41645 | B16: 0.000 | C16: 0.000 | D16: 0.000 | E16: 0.000 | F16: 0.000 | G16: 0.000 | H16: 0.000 | I16: 0.000 | J16: 0.000 | K16: 0.000 | L16: =SUM(B16:K16) -> 0.000 | M16: =IF((N16=0),0,L16/N16) -> 0.000 | N16: 0.00 | O16: 0.00
A17: 0 | B17: 0.000 | C17: 0.000 | D17: 0.000 | E17: 0.000 | F17: 0.000 | G17: 0.000 | H17: 0.000 | I17: 0.000 | J17: 0.000 | K17: 0.000 | L17: =SUM(B17:K17) -> 0.000 | M17: =IF((N17=0),0,L17/N17) -> 0.000 | N17: 0.00 | O17: 0.00
A18: 0 | B18: 0.000 | C18: 0.000 | D18: 0.000 | E18: 0.000 | F18: 0.000 | G18: 0.000 | H18: 0.000 | I18: 0.000 | J18: 0.000 | K18: 0.000 | L18: =SUM(B18:K18) -> 0.000 | M18: =IF((N18=0),0,L18/N18) -> 0.000 | N18: 0.00 | O18: 0.00
A19: 0 | B19: 0.000 | C19: 0.000 | D19: 0.000 | E19: 0.000 | F19: 0.000 | G19: 0.000 | H19: 0.000 | I19: 0.000 | J19: 0.000 | K19: 0.000 | L19: =SUM(B19:K19) -> 0.000 | M19: =IF((N19=0),0,L19/N19) -> 0.000 | N19: 0.00 | O19: 0.00
A20: 0 | B20: 0.000 | C20: 0.000 | D20: 0.000 | E20: 0.000 | F20: 0.000 | G20: 0.000 | H20: 0.000 | I20: 0.000 | J20: 0.000 | K20: 0.000 | L20: =SUM(B20:K20) -> 0.000 | M20: =IF((N20=0),0,L20/N20) -> 0.000 | N20: 0.00 | O20: 0.00
A21: 0 | B21: 0.000 | C21: 0.000 | D21: 0.000 | E21: 0.000 | F21: 0.000 | G21: 0.000 | H21: 0.000 | I21: 0.000 | J21: 0.000 | K21: 0.000 | L21: =SUM(B21:K21) -> 0.000 | M21: =IF((N21=0),0,L21/N21) -> 0.000 | N21: 0.00 | O21: 0.00
A22: 0 | B22: 0.000 | C22: 0.000 | D22: 0.000 | E22: 0.000 | F22: 0.000 | G22: 0.000 | H22: 0.000 | I22: 0.000 | J22: 0.000 | K22: 0.000 | L22: =SUM(B22:K22) -> 0.000 | M22: =IF((N22=0),0,L22/N22) -> 0.000 | N22: 0.00 | O22: 0.00
A23: 0 | B23: 0.000 | C23: 0.000 | D23: 0.000 | E23: 0.000 | F23: 0.000 | G23: 0.000 | H23: 0.000 | I23: 0.000 | J23: 0.000 | K23: 0.000 | L23: =SUM(B23:K23) -> 0.000 | M23: =IF((N23=0),0,L23/N23) -> 0.000 | N23: 0.00 | O23: 0.00
A24: 0 | B24: 0.000 | C24: 0.000 | D24: 0.000 | E24: 0.000 | F24: 0.000 | G24: 0.000 | H24: 0.000 | I24: 0.000 | J24: 0.000 | K24: 0.000 | L24: =SUM(B24:K24) -> 0.000 | M24: =IF((N24=0),0,L24/N24) -> 0.000 | N24: 0.00 | O24: 0.00
A25: 0 | B25: 0.000 | C25: 0.000 | D25: 0.000 | E25: 0.000 | F25: 0.000 | G25: 0.000 | H25: 0.000 | I25: 0.000 | J25: 0.000 | K25: 0.000 | L25: =SUM(B25:K25) -> 0.000 | M25: =IF((N25=0),0,L25/N25) -> 0.000 | N25: 0.00 | O25: 0.00
A26: 0 | B26: 0.000 | C26: 0.000 | D26: 0.000 | E26: 0.000 | F26: 0.000 | G26: 0.000 | H26: 0.000 | I26: 0.000 | J26: 0.000 | K26: 0.000 | L26: =SUM(B26:K26) -> 0.000 | M26: =IF((N26=0),0,L26/N26) -> 0.000 | N26: 0.00 | O26: 0.00
A27: 0 | B27: 0.000 | C27: 0.000 | D27: 0.000 | E27: 0.000 | F27: 0.000 | G27: 0.000 | H27: 0.000 | I27: 0.000 | J27: 0.000 | K27: 0.000 | L27: =SUM(B27:K27) -> 0.000 | M27: =IF((N27=0),0,L27/N27) -> 0.000 | N27: 0.00 | O27: 0.00
A28: 0 | B28: 0.000 | C28: 0.000 | D28: 0.000 | E28: 0.000 | F28: 0.000 | G28: 0.000 | H28: 0.000 | I28: 0.000 | J28: 0.000 | K28: 0.000 | L28: =SUM(B28:K28) -> 0.000 | M28: =IF((N28=0),0,L28/N28) -> 0.000 | N28: 0.00 | O28: 0.00
A29: 0 | B29: 0.000 | C29: 0.000 | D29: 0.000 | E29: 0.000 | F29: 0.000 | G29: 0.000 | H29: 0.000 | I29: 0.000 | J29: 0.000 | K29: 0.000 | L29: =SUM(B29:K29) -> 0.000 | M29: =IF((N29=0),0,L29/N29) -> 0.000 | N29: 0.00 | O29: 0.00
A30: 0 | B30: 0.000 | C30: 0.000 | D30: 0.000 | E30: 0.000 | F30: 0.000 | G30: 0.000 | H30: 0.000 | I30: 0.000 | J30: 0.000 | K30: 0.000 | L30: =SUM(B30:K30) -> 0.000 | M30: =IF((N30=0),0,L30/N30) -> 0.000 | N30: 0.00 | O30: 0.00
A31: 0 | B31: 0.000 | C31: 0.000 | D31: 0.000 | E31: 0.000 | F31: 0.000 | G31: 0.000 | H31: 0.000 | I31: 0.000 | J31: 0.000 | K31: 0.000 | L31: =SUM(B31:K31) -> 0.000 | M31: =IF((N31=0),0,L31/N31) -> 0.000 | N31: 0.00 | O31: 0.00
A32: 0 | B32: 0.000 | C32: 0.000 | D32: 0.000 | E32: 0.000 | F32: 0.000 | G32: 0.000 | H32: 0.000 | I32: 0.000 | J32: 0.000 | K32: 0.000 | L32: =SUM(B32:K32) -> 0.000 | M32: =IF((N32=0),0,L32/N32) -> 0.000 | N32: 0.00 | O32: 0.00
A33: 0 | B33: 0.000 | C33: 0.000 | D33: 0.000 | E33: 0.000 | F33: 0.000 | G33: 0.000 | H33: 0.000 | I33: 0.000 | J33: 0.000 | K33: 0.000 | L33: =SUM(B33:K33) -> 0.000 | M33: =IF((N33=0),0,L33/N33) -> 0.000 | N33: 0.00 | O33: 0.00
A34: 0 | B34: 0.000 | C34: 0.000 | D34: 0.000 | E34: 0.000 | F34: 0.000 | G34: 0.000 | H34: 0.000 | I34: 0.000 | J34: 0.000 | K34: 0.000 | L34: =SUM(B34:K34) -> 0.000 | M34: =IF((N34=0),0,L34/N34) -> 0.000 | N34: 0.00 | O34: 0.00
A35: 0 | B35: 0.000 | C35: 0.000 | D35: 0.000 | E35: 0.000 | F35: 0.000 | G35: 0.000 | H35: 0.000 | I35: 0.000 | J35: 0.000 | K35: 0.000 | L35: =SUM(B35:K35) -> 0.000 | M35: =IF((N35=0),0,L35/N35) -> 0.000 | N35: 0.00 | O35: 0.00
A36: 0 | B36: 0.000 | C36: 0.000 | D36: 0.000 | E36: 0.000 | F36: 0.000 | G36: 0.000 | H36: 0.000 | I36: 0.000 | J36: 0.000 | K36: 0.000 | L36: =SUM(B36:K36) -> 0.000 | M36: =IF((N36=0),0,L36/N36) -> 0.000 | N36: 0.00 | O36: 0.00
A37: 0 | B37: 0.000 | C37: 0.000 | D37: 0.000 | E37: 0.000 | F37: 0.000 | G37: 0.000 | H37: 0.000 | I37: 0.000 | J37: 0.000 | K37: 0.000 | L37: =SUM(B37:K37) -> 0.000 | M37: =IF((N37=0),0,L37/N37) -> 0.000 | N37: 0.00 | O37: 0.00
A38: 0 | B38: 0.000 | C38: 0.000 | D38: 0.000 | E38: 0.000 | F38: 0.000 | G38: 0.000 | H38: 0.000 | I38: 0.000 | J38: 0.000 | K38: 0.000 | L38: =SUM(B38:K38) -> 0.000 | M38: =IF((N38=0),0,L38/N38) -> 0.000 | N38: 0.00 | O38: 0.00
A39: 0 | B39: 0.000 | C39: 0.000 | D39: 0.000 | E39: 0.000 | F39: 0.000 | G39: 0.000 | H39: 0.000 | I39: 0.000 | J39: 0.000 | K39: 0.000 | L39: =SUM(B39:K39) -> 0.000 | M39: =IF((N39=0),0,L39/N39) -> 0.000 | N39: 0.00 | O39: 0.00
A40: 0 | B40: 0.000 | C40: 0.000 | D40: 0.000 | E40: 0.000 | F40: 0.000 | G40: 0.000 | H40: 0.000 | I40: 0.000 | J40: 0.000 | K40: 0.000 | L40: =SUM(B40:K40) -> 0.000 | M40: =IF((N40=0),0,L40/N40) -> 0.000 | N40: 0.00 | O40: 0.00
A41: 0 | B41: 0.000 | C41: 0.000 | D41: 0.000 | E41: 0.000 | F41: 0.000 | G41: 0.000 | H41: 0.000 | I41: 0.000 | J41: 0.000 | K41: 0.000 | L41: =SUM(B41:K41) -> 0.000 | M41: =IF((N41=0),0,L41/N41) -> 0.000 | N41: 0.00 | O41: 0.00
A42: Всего: | B42: =SUM(B11:B41) -> 0.000 | C42: =SUM(C11:C41) -> 0.000 | D42: =SUM(D11:D41) -> 367.80399322509766 | E42: =SUM(E11:E41) -> 338.17413330078125 | F42: =SUM(F11:F41) -> 0.000 | G42: =SUM(G11:G41) -> 366.64541625976562 | H42: =SUM(H11:H41) -> 0.000 | I42: =SUM(I11:I41) -> 0.000 | J42: =SUM(J11:J41) -> 359.18254089355469 | K42: =SUM(K11:K41) -> 0.000 | L42: =SUM(L11:L41) -> 1431.8060836791992 | M42: =IF((O42=0),0,L42/N42) -> 0.29690494486035501 | N42: =SUM(N11:N41) -> 4822.4393310546875 | O42: =SUM(O11:O41) -> 4828.8299560546875
A43: Максимум: | B43: =MAX(B11:B41) -> 0.000 | C43: =MAX(C11:C41) -> 0.000 | D43: =MAX(D11:D41) -> 93.250991821289063 | E43: =MAX(E11:E41) -> 88.820335388183594 | F43: =MAX(F11:F41) -> 0.000 | G43: =MAX(G11:G41) -> 92.997184753417969 | H43: =MAX(H11:H41) -> 0.000 | I43: =MAX(I11:I41) -> 0.000 | J43: =MAX(J11:J41) -> 94.5010986328125 | K43: =MAX(K11:K41) -> 0.000 | L43: =MAX(L11:L41) -> 369.56961059570312 | M43: =MAX(M11:M41) -> 0.30006803966999013 | N43: =MAX(N11:N41) -> 1249.490966796875 | O43: =MAX(O11:O41) -> 1246.8699951171875
A44: Среднее: | B44: 0.000 | C44: 0.000 | D44: 73.560798645019531 | E44: 67.63482666015625 | F44: 0.000 | G44: 73.329083251953122 | H44: 0.000 | I44: 0.000 | J44: 71.836508178710943 | K44: 0.000 | L44: 286.36121673583983 | M44: 0.23755170212368704 | N44: 964.48786621093745 | O44: 965.7659912109375
A45: Минимум: | B45: =MIN(B11:B41) -> 0.000 | C45: =MIN(C11:C41) -> 0.000 | D45: =MIN(D11:D41) -> 0.000 | E45: =MIN(E11:E41) -> 0.000 | F45: =MIN(F11:F41) -> 0.000 | G45: =MIN(G11:G41) -> 0.000 | H45: =MIN(H11:H41) -> 0.000 | I45: =MIN(I11:I41) -> 0.000 | J45: =MIN(J11:J41) -> 0.000 | K45: =MIN(K11:K41) -> 0.000 | L45: =MIN(L11:L41) -> 0.000 | M45: =MIN(M11:M41) -> 0.000 | N45: =MIN(N11:N41) -> 0.00 | O45: =MIN(O11:O41) -> 0.00
A50: Ст.мастер смены: | K50: ___________ | L50: /___________________/
A54: =NOW() -> 41645.005001041667