A1: data period - from: 2014-01-01 00:00:00 to: 2014-01-06 00:06:43
A3: ЦЕХ М-5
A5: МЕСЯЧНЫЙ БАЛАНС ПРОИЗВОДСТВА HNO3 (т.мнг)
B7: Выработка по потребителям | K7: Выработка по АСМ | M7: Разница
A8: Время | B8: План | C8: Факт | D8: Отклонение | E8: M-9 | F8: Магн. | G8: K-1 | H8: Стор.орг. | I8: Остаток | J8: Склад | K8: Факт | L8: Отклонение | M8: Факт
A9: день | B9: т.мнг/сут | C9: т.мнг/сут | D9: т.мнг/сут | E9: т.мнг/сут | F9: т.мнг/сут | G9: т.мнг/сут | H9: т.мнг/сут | I9: т.мнг/сут | J9: т.мнг | K9: т.мнг/сут | L9: т.мнг/сут | M9: т.мнг/сут
A11: 41640 | B11: 2375.00 | C11: =SUM(E11:I11) -> 1249.182140648365 | D11: =C11-B11 -> -1125.817859351635 | E11: 1198.0378344655037 | F11: 20.234760284423828 | G11: 0.00 | H11: 0.00 | I11: 30.9095458984375 | J11: 1339.9239501953125 | K11: 1246.8699951171875 | L11: =IF((K11=0),0,K11-B11) -> -1128.1300048828125 | M11: =IF((K11=0),0,C11-K11) -> 2.3121455311775208
A12: 41641 | B12: 2375.00 | C12: =SUM(E12:I12) -> 1209.1710327863693 | D12: =C12-B12 -> -1165.8289672136307 | E12: 1205.3260353803635 | F12: 28.017360687255859 | G12: 0.00 | H12: 0.00 | I12: -24.17236328125 | J12: 1315.7515869140625 | K12: 1201.949951171875 | L12: =IF((K12=0),0,K12-B12) -> -1173.050048828125 | M12: =IF((K12=0),0,C12-K12) -> 7.2210816144943237
A13: 41642 | B13: 2375.00 | C13: =SUM(E13:I13) -> 1178.1952497959137 | D13: =C13-B13 -> -1196.8047502040863 | E13: 1192.2065260410309 | F13: 16.343460083007813 | G13: 0.00 | H13: 0.00 | I13: -30.354736328125 | J13: 1285.3968505859375 | K13: 1185.9200439453125 | L13: =IF((K13=0),0,K13-B13) -> -1189.0799560546875 | M13: =IF((K13=0),0,C13-K13) -> -7.7247941493988037
A14: 41643 | B14: 2375.00 | C14: =SUM(E14:I14) -> 1185.5861550569534 | D14: =C14-B14 -> -1189.4138449430466 | E14: 1191.469686627388 | F14: 14.00868034362793 | G14: 0.00 | H14: 0.00 | I14: -19.8922119140625 | J14: 1265.504638671875 | K14: 1194.0899658203125 | L14: =IF((K14=0),0,K14-B14) -> -1180.9100341796875 | M14: =IF((K14=0),0,C14-K14) -> -8.5038107633590698
A15: 41644 | B15: 2375.00 | C15: =SUM(E15:I15) -> 1184.91139960289 | D15: =C15-B15 -> -1190.08860039711 | E15: 1189.149436712265 | F15: 0.00 | G15: 0.00 | H15: 0.00 | I15: -4.238037109375 | J15: 1261.2666015625 | K15: 0.00 | L15: =IF((K15=0),0,K15-B15) -> 0.00 | M15: =IF((K15=0),0,C15-K15) -> 0.00
A16: 41645 | B16: 0.00 | C16: =SUM(E16:I16) -> 0.00 | D16: =C16-B16 -> 0.00 | E16: 0.00 | F16: 0.00 | G16: 0.00 | H16: 0.00 | I16: 0.00 | J16: 0.00 | K16: 0.00 | L16: =IF((K16=0),0,K16-B16) -> 0.00 | M16: =IF((K16=0),0,C16-K16) -> 0.00
A17: 0 | B17: 0.00 | C17: =SUM(E17:I17) -> 0.00 | D17: =C17-B17 -> 0.00 | E17: 0.00 | F17: 0.00 | G17: 0.00 | H17: 0.00 | I17: 0.00 | J17: 0.00 | K17: 0.00 | L17: =IF((K17=0),0,K17-B17) -> 0.00 | M17: =IF((K17=0),0,C17-K17) -> 0.00
A18: 0 | B18: 0.00 | C18: =SUM(E18:I18) -> 0.00 | D18: =C18-B18 -> 0.00 | E18: 0.00 | F18: 0.00 | G18: 0.00 | H18: 0.00 | I18: 0.00 | J18: 0.00 | K18: 0.00 | L18: =IF((K18=0),0,K18-B18) -> 0.00 | M18: =IF((K18=0),0,C18-K18) -> 0.00
A19: 0 | B19: 0.00 | C19: =SUM(E19:I19) -> 0.00 | D19: =C19-B19 -> 0.00 | E19: 0.00 | F19: 0.00 | G19: 0.00 | H19: 0.00 | I19: 0.00 | J19: 0.00 | K19: 0.00 | L19: =IF((K19=0),0,K19-B19) -> 0.00 | M19: =IF((K19=0),0,C19-K19) -> 0.00
A20: 0 | B20: 0.00 | C20: =SUM(E20:I20) -> 0.00 | D20: =C20-B20 -> 0.00 | E20: 0.00 | F20: 0.00 | G20: 0.00 | H20: 0.00 | I20: 0.00 | J20: 0.00 | K20: 0.00 | L20: =IF((K20=0),0,K20-B20) -> 0.00 | M20: =IF((K20=0),0,C20-K20) -> 0.00
A21: 0 | B21: 0.00 | C21: =SUM(E21:I21) -> 0.00 | D21: =C21-B21 -> 0.00 | E21: 0.00 | F21: 0.00 | G21: 0.00 | H21: 0.00 | I21: 0.00 | J21: 0.00 | K21: 0.00 | L21: =IF((K21=0),0,K21-B21) -> 0.00 | M21: =IF((K21=0),0,C21-K21) -> 0.00
A22: 0 | B22: 0.00 | C22: =SUM(E22:I22) -> 0.00 | D22: =C22-B22 -> 0.00 | E22: 0.00 | F22: 0.00 | G22: 0.00 | H22: 0.00 | I22: 0.00 | J22: 0.00 | K22: 0.00 | L22: =IF((K22=0),0,K22-B22) -> 0.00 | M22: =IF((K22=0),0,C22-K22) -> 0.00
A23: 0 | B23: 0.00 | C23: =SUM(E23:I23) -> 0.00 | D23: =C23-B23 -> 0.00 | E23: 0.00 | F23: 0.00 | G23: 0.00 | H23: 0.00 | I23: 0.00 | J23: 0.00 | K23: 0.00 | L23: =IF((K23=0),0,K23-B23) -> 0.00 | M23: =IF((K23=0),0,C23-K23) -> 0.00
A24: 0 | B24: 0.00 | C24: =SUM(E24:I24) -> 0.00 | D24: =C24-B24 -> 0.00 | E24: 0.00 | F24: 0.00 | G24: 0.00 | H24: 0.00 | I24: 0.00 | J24: 0.00 | K24: 0.00 | L24: =IF((K24=0),0,K24-B24) -> 0.00 | M24: =IF((K24=0),0,C24-K24) -> 0.00
A25: 0 | B25: 0.00 | C25: =SUM(E25:I25) -> 0.00 | D25: =C25-B25 -> 0.00 | E25: 0.00 | F25: 0.00 | G25: 0.00 | H25: 0.00 | I25: 0.00 | J25: 0.00 | K25: 0.00 | L25: =IF((K25=0),0,K25-B25) -> 0.00 | M25: =IF((K25=0),0,C25-K25) -> 0.00
A26: 0 | B26: 0.00 | C26: =SUM(E26:I26) -> 0.00 | D26: =C26-B26 -> 0.00 | E26: 0.00 | F26: 0.00 | G26: 0.00 | H26: 0.00 | I26: 0.00 | J26: 0.00 | K26: 0.00 | L26: =IF((K26=0),0,K26-B26) -> 0.00 | M26: =IF((K26=0),0,C26-K26) -> 0.00
A27: 0 | B27: 0.00 | C27: =SUM(E27:I27) -> 0.00 | D27: =C27-B27 -> 0.00 | E27: 0.00 | F27: 0.00 | G27: 0.00 | H27: 0.00 | I27: 0.00 | J27: 0.00 | K27: 0.00 | L27: =IF((K27=0),0,K27-B27) -> 0.00 | M27: =IF((K27=0),0,C27-K27) -> 0.00
A28: 0 | B28: 0.00 | C28: =SUM(E28:I28) -> 0.00 | D28: =C28-B28 -> 0.00 | E28: 0.00 | F28: 0.00 | G28: 0.00 | H28: 0.00 | I28: 0.00 | J28: 0.00 | K28: 0.00 | L28: =IF((K28=0),0,K28-B28) -> 0.00 | M28: =IF((K28=0),0,C28-K28) -> 0.00
A29: 0 | B29: 0.00 | C29: =SUM(E29:I29) -> 0.00 | D29: =C29-B29 -> 0.00 | E29: 0.00 | F29: 0.00 | G29: 0.00 | H29: 0.00 | I29: 0.00 | J29: 0.00 | K29: 0.00 | L29: =IF((K29=0),0,K29-B29) -> 0.00 | M29: =IF((K29=0),0,C29-K29) -> 0.00
A30: 0 | B30: 0.00 | C30: =SUM(E30:I30) -> 0.00 | D30: =C30-B30 -> 0.00 | E30: 0.00 | F30: 0.00 | G30: 0.00 | H30: 0.00 | I30: 0.00 | J30: 0.00 | K30: 0.00 | L30: =IF((K30=0),0,K30-B30) -> 0.00 | M30: =IF((K30=0),0,C30-K30) -> 0.00
A31: 0 | B31: 0.00 | C31: =SUM(E31:I31) -> 0.00 | D31: =C31-B31 -> 0.00 | E31: 0.00 | F31: 0.00 | G31: 0.00 | H31: 0.00 | I31: 0.00 | J31: 0.00 | K31: 0.00 | L31: =IF((K31=0),0,K31-B31) -> 0.00 | M31: =IF((K31=0),0,C31-K31) -> 0.00
A32: 0 | B32: 0.00 | C32: =SUM(E32:I32) -> 0.00 | D32: =C32-B32 -> 0.00 | E32: 0.00 | F32: 0.00 | G32: 0.00 | H32: 0.00 | I32: 0.00 | J32: 0.00 | K32: 0.00 | L32: =IF((K32=0),0,K32-B32) -> 0.00 | M32: =IF((K32=0),0,C32-K32) -> 0.00
A33: 0 | B33: 0.00 | C33: =SUM(E33:I33) -> 0.00 | D33: =C33-B33 -> 0.00 | E33: 0.00 | F33: 0.00 | G33: 0.00 | H33: 0.00 | I33: 0.00 | J33: 0.00 | K33: 0.00 | L33: =IF((K33=0),0,K33-B33) -> 0.00 | M33: =IF((K33=0),0,C33-K33) -> 0.00
A34: 0 | B34: 0.00 | C34: =SUM(E34:I34) -> 0.00 | D34: =C34-B34 -> 0.00 | E34: 0.00 | F34: 0.00 | G34: 0.00 | H34: 0.00 | I34: 0.00 | J34: 0.00 | K34: 0.00 | L34: =IF((K34=0),0,K34-B34) -> 0.00 | M34: =IF((K34=0),0,C34-K34) -> 0.00
A35: 0 | B35: 0.00 | C35: =SUM(E35:I35) -> 0.00 | D35: =C35-B35 -> 0.00 | E35: 0.00 | F35: 0.00 | G35: 0.00 | H35: 0.00 | I35: 0.00 | J35: 0.00 | K35: 0.00 | L35: =IF((K35=0),0,K35-B35) -> 0.00 | M35: =IF((K35=0),0,C35-K35) -> 0.00
A36: 0 | B36: 0.00 | C36: =SUM(E36:I36) -> 0.00 | D36: =C36-B36 -> 0.00 | E36: 0.00 | F36: 0.00 | G36: 0.00 | H36: 0.00 | I36: 0.00 | J36: 0.00 | K36: 0.00 | L36: =IF((K36=0),0,K36-B36) -> 0.00 | M36: =IF((K36=0),0,C36-K36) -> 0.00
A37: 0 | B37: 0.00 | C37: =SUM(E37:I37) -> 0.00 | D37: =C37-B37 -> 0.00 | E37: 0.00 | F37: 0.00 | G37: 0.00 | H37: 0.00 | I37: 0.00 | J37: 0.00 | K37: 0.00 | L37: =IF((K37=0),0,K37-B37) -> 0.00 | M37: =IF((K37=0),0,C37-K37) -> 0.00
A38: 0 | B38: 0.00 | C38: =SUM(E38:I38) -> 0.00 | D38: =C38-B38 -> 0.00 | E38: 0.00 | F38: 0.00 | G38: 0.00 | H38: 0.00 | I38: 0.00 | J38: 0.00 | K38: 0.00 | L38: =IF((K38=0),0,K38-B38) -> 0.00 | M38: =IF((K38=0),0,C38-K38) -> 0.00
A39: 0 | B39: 0.00 | C39: =SUM(E39:I39) -> 0.00 | D39: =C39-B39 -> 0.00 | E39: 0.00 | F39: 0.00 | G39: 0.00 | H39: 0.00 | I39: 0.00 | J39: 0.00 | K39: 0.00 | L39: =IF((K39=0),0,K39-B39) -> 0.00 | M39: =IF((K39=0),0,C39-K39) -> 0.00
A40: 0 | B40: 0.00 | C40: =SUM(E40:I40) -> 0.00 | D40: =C40-B40 -> 0.00 | E40: 0.00 | F40: 0.00 | G40: 0.00 | H40: 0.00 | I40: 0.00 | J40: 0.00 | K40: 0.00 | L40: =IF((K40=0),0,K40-B40) -> 0.00 | M40: =IF((K40=0),0,C40-K40) -> 0.00
A41: 0 | B41: 0.00 | C41: =SUM(E41:I41) -> 0.00 | D41: =C41-B41 -> 0.00 | E41: 0.00 | F41: 0.00 | G41: 0.00 | H41: 0.00 | I41: 0.00 | J41: 0.00 | K41: 0.00 | L41: =IF((K41=0),0,K41-B41) -> 0.00 | M41: =IF((K41=0),0,C41-K41) -> 0.00
A42: Всего: | B42: =SUM(B11:B41) -> 11875.00 | C42: =SUM(C11:C41) -> 6007.0459778904915 | D42: =SUM(D11:D41) -> -5867.9540221095085 | E42: =SUM(E11:E41) -> 5976.1895192265511 | F42: =SUM(F11:F41) -> 78.60426139831543 | G42: =SUM(G11:G41) -> 0.00 | H42: =SUM(H11:H41) -> 0.00 | K42: =SUM(K11:K41) -> 4828.8299560546875 | L42: =SUM(L11:L41) -> -4671.1700439453125 | M42: =SUM(M11:M41) -> -6.6953777670860291
A43: Максимум: | B43: =MAX(B11:B41) -> 2375.00 | C43: =MAX(C11:C41) -> 1249.182140648365 | D43: =MAX(D11:D41) -> 0.00 | E43: =MAX(E11:E41) -> 1205.3260353803635 | F43: =MAX(F11:F41) -> 28.017360687255859 | G43: =MAX(G11:G41) -> 0.00 | H43: =MAX(H11:H41) -> 0.00 | I43: =MAX(I11:I41) -> 30.9095458984375 | J43: =MAX(J11:J41) -> 1339.9239501953125 | K43: =MAX(K11:K41) -> 1246.8699951171875 | L43: =MAX(L11:L41) -> 0.00 | M43: =MAX(M11:M41) -> 7.2210816144943237
A44: Среднее: | B44: 2375.00 | C44: 1201.4091955780982 | D44: -1173.5908044219018 | E44: 1195.2379038453103 | F44: 15.720852279663086 | G44: 0.00 | H44: 0.00 | I44: -9.549560546875 | J44: 1293.5687255859375 | K44: 965.7659912109375 | L44: -934.2340087890625 | M44: -1.3390755534172059
A45: Минимум: | B45: =MIN(B11:B41) -> 0.00 | C45: =MIN(C11:C41) -> 0.00 | D45: =MIN(D11:D41) -> -1196.8047502040863 | E45: =MIN(E11:E41) -> 0.00 | F45: =MIN(F11:F41) -> 0.00 | G45: =MIN(G11:G41) -> 0.00 | H45: =MIN(H11:H41) -> 0.00 | I45: =MIN(I11:I41) -> -30.354736328125 | J45: =MIN(J11:J41) -> 0.00 | K45: =MIN(K11:K41) -> 0.00 | L45: =MIN(L11:L41) -> -1189.0799560546875 | M45: =MIN(M11:M41) -> -8.5038107633590698
A50: Ст.мастер смены: | K50: ___________ | L50: /___________________/
A54: =NOW() -> 41645.004808564816